,Unnamed: 0.1,Unnamed: 0,Authors,Title,Year,DOI,Link,Abstract,Author Keywords,Index Keywords,Document Type,Publication Type,Article Title,Keywords Plus,Publication Date,Publication Year,DOI Link,Use in Thesis,Priority,Use for Thesis
34,216,299,"Beetz J., Van Leeuwen J., De Vries B.",IfcOWL: A case of transforming EXPRESS schemas into ontologies,2009.0,10.1017/S0890060409000122,https://www.scopus.com/inward/record.uri?eid=2-s2.0-68349154149&doi=10.1017%2fS0890060409000122&partnerID=40&md5=c7747d560e734da00c4cc439139b474b,"Ontologies have been successfully applied as a semantic enabler of communication between both users and applications in fragmented, heterogeneous multinational business environments. In this paper we discuss the underlying principles, their current implementation status, and most importantly, their applicability to problems in the building information modeling domain. We introduce the development of an ontology for the building and construction sector based on the industry foundation classes. We discuss several approaches of lifting modeling information that is based on the express family of languages for data modeling onto a logically rigid and semantically enhanced ontological level encoded in the W3C Ontology Web Language. We exemplify the added value of such formal notation of building models by providing several examples where generic query and reasoning algorithms can be applied to problems that otherwise have to be manually hard-wired into applications for processing building information. Furthermore, we show how the underlying resource description framework and the set of technologies evolving around it can be tailored to the need of distributed collaborative work in the building and construction industry. Copyright © 2009 Cambridge University Press.",Building Information Modeling; Knowledge Representation; Model-Driven Architectures; Ontologies,Added values; Building and construction; Building Information Modeling; Building model; Collaborative Work; Data modeling; Formal notations; Industry Foundation Classes - IFC; Model-Driven Architectures; Multinational business; Ontology web language; Reasoning algorithms; Resource description framework; Schemas; Underlying principles; Architectural design; Construction industry; Knowledge representation; Linguistics; Model buildings; Query languages; Systems analysis; Ontology,Article,,,,,,,,2,"Check if from Powels. ifcOWL, ontology and connection to w3C owl."
36,228,190,"Niknam M., Karshenas S.",Integrating BIM and Project Schedule Information Using Semantic Web Technology,2016.0,10.1061/9780784479827.070,https://www.scopus.com/inward/record.uri?eid=2-s2.0-84976428115&doi=10.1061%2f9780784479827.070&partnerID=40&md5=e8abcd9a2c88f96e97baf94f1dfbd678,"A construction project requires collaboration of a large number of individuals working in different organizations to deliver the project on time and within the budget. Architecture, engineering, and construction industry spends time and money to solve the information sharing and interoperability issues between different domains. With the advent of building information modeling, a 3D CAD model of a project is used as a shared knowledge resource during the design, construction, and facility management phases of a project's life cycle. Currently, 4D models are created by combining CAD and schedule information. A 4D model is useful for detecting potential construction conflicts during the project planning and design and a valuable tool during construction. However, creating 4D models requires a great amount of human involvement. An approach that facilitates integrating BIM and schedule information can improve efficiency and is highly desirable. This paper presents a new approach to information modeling using the Semantic Web technology. The Semantic Web provides an infrastructure and a data modeling format that allows computers to access and combine information distributed over the Internet. The paper discusses: (1) ontologies that the authors have developed for BIM and project schedule information; (2) how ontologies are used for creating project knowledge bases in RDF/OWL format; and (3) how project knowledge bases can facilitate machine processing of project information and semantic interoperability among project knowledge bases. The Semantic Web approach allows information to be saved once at the provider source and be used by authorized users as needed. This means BIM information is created and maintained by designers and project schedule is created and maintained by schedulers on their respective servers. This would allow the latest BIM and project schedule information to be accessed over the Internet and combined for various purposes. © ASCE.",,"Architectural design; Budget control; Computer aided design; Construction industry; Information analysis; Information management; Information theory; Information use; Internet; Interoperability; Life cycle; Office buildings; Semantic Web; Architecture , engineering , and constructions; Building Information Model - BIM; Construction projects; Information Modeling; Project informations; Semantic interoperability; Semantic web approach; Semantic Web technology; Project management",Conference Paper,,,,,,,,3,Look at point (2) how ontologies are used for creating project knowledge bases in RDF/OWL format
37,233,135,"Usman Z.S., Tah J.H.M., Abanda F.H., Nche C.",Integration of an ontology with ifc for efficient knowledge discovery in the construction domain,2018.0,10.1201/9780429506215-54,https://www.scopus.com/inward/record.uri?eid=2-s2.0-85079330758&doi=10.1201%2f9780429506215-54&partnerID=40&md5=4ad6d2ad1201101e5ffe93fe7b9f41d4,"In the most recent years, the Semantic Web applied to Building Information Modelling and Industry Foundation Classes are the most widely recognized efforts in the digitalization of products in the architectural, engineering and construction industry. This study performs knowledge discovery of construction products from domain experts to build an ontology. However, ontology developed becomes an isolated conceptualization. In order to get rich domain ontology, novel approach is to retrieve knowledge from domain-specific online product repositories such as the industry foundation classes. This study identifies similarities between the industry foundation classes and ontology likewise their differences with the hope that it would develop an enhanced knowledge conceptualization of the domain. Integration of IFC and ontology will mean that concepts represent well-established standard terms rich in domain knowledge. Other semantic web technologies can then be exploited on the resulting application to perform data querying, consistency checking, data reasoning, knowledge inference and so much more. Thus, the resulting ontology could be standardized and be easily applied for use in practice in the industry. © 2018 Taylor & Francis Group, London.",Industry Foundation Classes (IFC); Ontology; Photovoltaic Systems (PV); Semantic Web (SW); Web Ontology Language (OWL),"Construction industry; Foundations; Photovoltaic cells; Process engineering; Semantic Web; Architectural , engineering and constructions; Building Information Modelling; Construction products; Industry Foundation Classes - IFC; Knowledge conceptualization; Photovoltaic systems; Semantic Web technology; Web ontology language; Ontology",Conference Paper,,,,,,,,3,compare with Powels - otherwise discard
41,297,56,"Karlapudi J., Valluru P., Menzel K.",Ontological approach for LOD-sensitive BIM-data management,2021.0,,https://www.scopus.com/inward/record.uri?eid=2-s2.0-85124426983&partnerID=40&md5=0d4795a39b7451e22b2d0a9a231c7fbc,"The construction industry is a collaborative environment with the involvement of multiple disciplines and activities throughout the Building Lifecycle Stages. The collaboration requires the iterative and coordinated exchange of information for significant improvement of the building design, construction and management. The successful representation of these information refinements enables the identification of the required level of detail (LOD) for data sharing parameters between the multiple disciplines. Since the last decade, LOD is a promising approach for efficient representation of semantically rich BIM data in different levels. Despite the improvement, there is a lack of efficient implementation in building lifecycle functionalities, because of their fundamental heterogeneity, versatility and adaptability. The proposed approach enables the representation of LOD-sensitive BIM data through the formal definition of ontologies. The paper validates this approach based on the concept of competency questions and their respective SPARQL queries. With the demonstration and validation, the paper provides the conceptual proof for the practical application of the developed approach. The proposed solution can also be easily adaptable and applicable to the present BIM process since the representation of BIM data in different ontologies (BOT, ifcOWL, etc.) are within reach. © 2021 Copyright for this paper by its authors.",BIM; Competency questions; LOD; Ontologies; SPARQL queries,Architectural design; Construction; Construction industry; Information management; Life cycle; BIM; Building life cycle; Collaborative environments; Competency question; Exchange of information; Level-of-detail; Life cycle stages; Multiple disciplines; Ontological approach; Ontology's; Ontology,Conference Paper,,,,,,,,3,Look at SPARQL-Queries and read conclusion
44,324,236,"Karshenas S., Niknam M.",Ontology-based building information modeling,2013.0,10.1061/9780784413029.060,https://www.scopus.com/inward/record.uri?eid=2-s2.0-84887400134&doi=10.1061%2f9780784413029.060&partnerID=40&md5=4f54c6e4d1f9a854d3000aaba5dda8e4,"The World Wide Web has provided a vast distributed information space that is primarily designed for human consumption. The enmeshment of the Web and various business processes has made it imperative to define business information in a format that facilitates machine-to-machine exchange and automated processing. The construction industry is not an exception; construction business processes depend on a diverse set of information sources. For efficient processing of the construction business information, it is necessary to publish the information in a format that allows computer applications to easily discover, query and share the information. Currently, the standard for representing, accessing, and sharing a building model is the Industry Foundation Classes (IFCs) data model. Several researchers have investigated the limitations of IFCs data model for interoperability among heterogeneous software applications. This paper presents the results of an on-going research on an ontology-based approach to building information modeling to facilitate information exchange among different knowledge domain applications. The approach developed in this study is based on a shared building ontology that models building domain element types and element relationships. The information systems to be integrated should be modeled using the shared ontology; each knowledge domain adds its own element properties to the shared building ontology. SWRL rules are used for mapping element properties from one domain to another. An example demonstrates how the developed approach can facilitate project information sharing between design and estimating domains. © 2013 American Society of Civil Engineers.",,Application programs; Architectural design; Construction industry; Information systems; Information theory; Knowledge management; Ontology; Query processing; Building Information Model - BIM; Business information; Construction business; Distributed information; Heterogeneous software applications; Industry Foundation Classes - IFC; Information exchanges; Project informations; Information dissemination,Conference Paper,,,,,,,,2,Understanding of developing and connecting ontologies. 
45,325,227,"Park M., Lee K.-W., Lee H.-S., Jiayi P., Yu J.",Ontology-based construction knowledge retrieval system,2013.0,10.1007/s12205-013-1155-6,https://www.scopus.com/inward/record.uri?eid=2-s2.0-84886292123&doi=10.1007%2fs12205-013-1155-6&partnerID=40&md5=10cd78de4b0f1b18ecac5afd92a1f213,"Managing knowledge effectively is critical to the competitive power of a company. Knowledge is used as an important resource in many industrial areas, and so it follows that there is a growing interest in knowledge management within the construction industry. Yet because of the unique characteristics of construction knowledge created during projects, there are limitations to its capture and reuse. The knowledge produced during construction projects is project-oriented, experiential, and context specific; due to these characteristics, the reuse of knowledge is difficult. In this research, research team focus on capturing and identifying the characteristics of construction knowledge, then propose a method for applying these characteristics to the development of an ontology-based construction knowledge retrieval system. Moreover, research team developed a system prototype that applies ontology in suggesting related search words during the search process and validated the effectiveness of the prototype in terms of precision and recall rate. By applying the prototype, the precision and recall rate was improved by approximately 10∼30%. © 2013 Korean Society of Civil Engineers and Springer-Verlag Berlin Heidelberg.",construction knowledge; information technology; knowledge retrieval; ontology,Competitive power; Construction knowledge; Construction projects; Industrial area; Knowledge retrieval; Precision and recall; Research teams; System prototype; Construction industry; Information retrieval; Information technology; Knowledge management; Research; Ontology,Article,,,,,,,,1,"Building an ontology for construction industry - and construction knowledge retrieval system - might be used as a method to ""capture"" the knowledge of Zirkular?"
47,327,272,"Wang G., He G., Bian L.",Ontology-based interorganizational knowledge management in sustainable construction project,2011.0,10.4028/www.scientific.net/AMR.243-249.6339,https://www.scopus.com/inward/record.uri?eid=2-s2.0-79958048907&doi=10.4028%2fwww.scientific.net%2fAMR.243-249.6339&partnerID=40&md5=61b94c1dbbc6b4f71a67fa11ea8fe7b0,"Due to the great negative impact, the construction industry needs to undergo a paradigm shift from traditional construction to sustainable construction. To reach the goal of sustainable development, the construction industry needs to intensify its efforts to move to a knowledge intensive mode. Based on the analysis of e-Cognos and the concept of ontology, this paper proposes that e-Cognos ontology can be applied in the development of sustainable construction process ontology, which is a key part of knowledge management system (KMS). Following this, the application process of ontology-based KMS is analyzed using IDEF0 modeling method. Finally, this paper analyzes interorganizational collaboration model in sustainable project. © (2011) Trans Tech Publications.",IDEF0; Knowledge management; Ontology; Sustainable construction,Application process; IDEF0; Interorganizational collaboration; Key parts; Knowledge management system; Modeling method; Negative impacts; Ontology-based; Paradigm shifts; Sustainable construction; Sustainable project; Building materials; Civil engineering; Construction equipment; Construction industry; Knowledge based systems; Knowledge management; Ontology; Project management,Conference Paper,,,,,,,,2,Sustainable Construction Ontology - look at conclusion
49,332,226,"Zhang L., Issa R.R.A.",Ontology-based partial building information model extraction,2013.0,10.1061/(ASCE)CP.1943-5487.0000277,https://www.scopus.com/inward/record.uri?eid=2-s2.0-84886505825&doi=10.1061%2f%28ASCE%29CP.1943-5487.0000277&partnerID=40&md5=b9a8c8ddfa9c19adfe8fc230f9960bfa,"The current application of building information modeling (BIM) in the construction industry is generally focused on using the complete building information model during the life cycle of the project. With more information being added to the model, the size of the model file and the difficulty to manipulate the model increase. However, different use scenarios may only require access to certain specific information stored in the model. In contrast with the ample research of ontology applications in construction knowledge management, research of ontology in construction modeling has been limited. Hence, the purpose of this study is to use ontology in the extraction of a partial building information model from the original complete model. The building information models covered in this study are in the Industry Foundation Classes (IFC) format, which is a widely supported open BIM standard. An ontology TBox is developed according to the existing IFC schema specifications. For each specific IFC model, an ontology ABox is generated at run time, combining the ontology TBox and the IFC instances in the model. The ABox works as an index in the partial model extraction algorithm. A prototype Java program based on the algorithm was developed to demonstrate and validate the algorithm using both a sample model and an IFC model from a real building. The results indicated that the use of ontology provides a valid way to deal with the technical complexity of IFC models. © 2013 American Society of Civil Engineers.",Building information modeling (BIM); Extraction algorithm; Industry Foundation Classes (IFC); Ontology; Partial model,Building Information Model - BIM; Construction knowledge managements; Extraction algorithms; Industry Foundation Classes - IFC; Ontology applications; Partial modeling; Specific information; Technical complexity; Algorithms; Buildings; Computer software; Construction industry; Extraction; Java programming language; Knowledge management; Ontology; Architectural design,Conference Paper,,,,,,,,1,Difference between ontology for construction knowledge management and ontology for construction modeling. Look at the differentiation
50,344,175,"Zhou Z., Goh Y.M., Shen L.",Overview and Analysis of Ontology Studies Supporting Development of the Construction Industry,2016.0,10.1061/(ASCE)CP.1943-5487.0000594,https://www.scopus.com/inward/record.uri?eid=2-s2.0-84992217086&doi=10.1061%2f%28ASCE%29CP.1943-5487.0000594&partnerID=40&md5=5ec5f002e31865699146067289d621d8,"Being information-intensive, the construction industry has the feature of multiagents, including multiparticipants from different disciplines, multiprocesses with a long-span timeline, and multidocuments generated by various systems. The multistakeholder context of the construction industry creates problems such as poor information interoperability and low productivity arising from difficulties in information reuse. Many researchers have explored the use of ontology to address these issues. This study aims to review ontology research to explore its trends, gaps, and opportunities in the construction industry. A systematic process employing three-phase search method, objective analysis and subjective analysis, helps to provide enough potential articles related to construction ontology research, and to reduce arbitrariness and subjectivity involved in research topic analysis. As a result, three main research topics aligned with the ontology development lifecycle were derived as follows: information integration based on ontology, ontology building, and ontology application. In addition, research gaps and the corresponding research agenda were identified. This detailed review provides the basis for further studies on the use of ontology in the construction industry. The research trends and gaps can serve as motivation for researchers and practitioners to work on the next generation of ontology studies to support the development of the construction industry. © 2016 American Society of Civil Engineers.",Cluster analysis; Construction industry; Information interoperability; Knowledge representation; Ontology; Semantic web; Word cloud,Cluster analysis; Construction industry; Interoperability; Knowledge representation; Ontology; Semantic Web; Information integration; Information interoperability; Information re use; Ontology applications; Ontology development; Subjective analysis; Systematic process; Word clouds; Information use,Article,,,,,,,,1,Overview over ontologies in the construction industry
52,362,179,"Pauwels P., De Farias T.M., Zhang C., Roxin A., Beetz J., Roo J.D., Nicolle C.",Querying and reasoning over large scale building data sets: An outline of a performance benchmark,2016.0,10.1145/2928294.2928303,https://www.scopus.com/inward/record.uri?eid=2-s2.0-85044624002&doi=10.1145%2f2928294.2928303&partnerID=40&md5=1edaee36a482d8f3c13745c28eb65c5a,"The architectural design and construction domains work on a daily basis with massive amounts of data. Properly managing, exchanging and exploiting these data is an ever ongoing challenge in this domain. This has resulted in large semantic RDF graphs that are to be combined with a significant number of other data sets (building product catalogues, regulation data, geometric point cloud data, simulation data, sensor data), thus making an already huge dataset even larger. Making these big data available at high performance rates and speeds and into the correct (intuitive) formats is therefore an incredibly high challenge in this domain. Yet, hardly any benchmark is available for this industry that (1) gives an overview of the kind of data typically handled in this domain; and (2) that lists the query and reasoning performance results in handling these data. In this article, we therefore present a set of available sample data that explicates the scale of the situation, and we additionally perform a query and reasoning performance benchmark. This results not only in an initial set of quantitative performance results, but also in recommendations in implementing a web-based system relying heavily on large semantic data. As such, we propose an initial benchmark through which new upcoming data management proposals in the architectural design and construction domains can be measured. © 2016 ACM.",Benchmark; Big data; Building information modeling; Built environment; IFC; OWL; Reasoning; Semantic web,Architectural design; Benchmarking; Data handling; Information management; Semantic Web; Building Information Model - BIM; Building products; Built environment; Design and construction; Large scale buildings; Point cloud data; Reasoning; Reasoning performance; Big data,Conference Paper,,,,,,,,2,V as Variety - paper looks at different data handled in CI BigData. Especially look at '(1) gives an overview of the kind of data typically handled in this domain'
53,363,117,"Werbrouck J.M., Senthilvel M., Beetz J., Pauwels P.",Querying heterogeneous linked building data with context-expanded GraphQL queries?,2019.0,,https://www.scopus.com/inward/record.uri?eid=2-s2.0-85068806275&partnerID=40&md5=2128318c30b25e467ca0eb415fb1e9fa,"Linked Data in the construction industry is a topic gaining serious interest over the last years. However, this interest remains largely academic and has not sparked much adoption of web technologies in the field. To nourish adoption of Linked Data in practice, access to the data has to be made more easy. SPARQL, the recommended RDF query language, has proven very powerful for retrieving and updating RDF datasets. However, due to its verbosity and complexity, it is often considered a threshold for developers to implement in their tools. In this paper, we compare SPARQL with Linked Data querying languages that extend the GraphQL syntax, in context of querying building datasets: HyperGraphQL and GraphQL-LD. Since it went open source in 2015, GraphQL has been adopted by a large community of developers, partly due to its elegance and conciseness. As a use case, the queries are performed on an RDF-based multi-model that relies on the recent ISO standard ICDD (ISO 21597). ICDD interlinks information on a sub-document identifier level, based on OWL. It is aimed at the industry in that it adds a layer of Linked Data to documentation formats that are still widely used in practice: IFC, spreadsheets, imagery etc. Therefore, it is considered a tuned use case for comparing these different RDF query languages. © 2019 CEUR-WS. All rights reserved.",GraphQL; ICDD; Linked Data; SPARQL,Construction industry; Data handling; ISO Standards; Query languages; Data querying; Document identifiers; GraphQL; ICDD; Open sources; RDF query language; SPARQL; Web technologies; Linked data,Conference Paper,,,,,,,,1,Overview on SPARQL and GRAPHQL - skim for information about SPARQL (RDF Query language). Furthermore useful for background information about the DBMS
