Authors,Author(s) ID,Title,Year,Source title,Volume,Issue,Art. No.,Page start,Page end,Page count,Cited by,DOI,Link,Affiliations,Authors with affiliations,Abstract,Author Keywords,Index Keywords,Document Type,Publication Stage,Open Access,Source,EID
"Nijgh M.P., Gîrbacea I.A., Veljkovic M.","57199394715;57205392514;55502801700;","Elastic behaviour of a tapered steel-concrete composite beam optimized for reuse",2019,"Engineering Structures","183",,,"366","374",,15,"10.1016/j.engstruct.2019.01.022","https://www.scopus.com/inward/record.uri?eid=2-s2.0-85059835137&doi=10.1016%2fj.engstruct.2019.01.022&partnerID=40&md5=9b189444ff8c7368de31260fbceb374a","Faculty of Civil Engineering and Geosciences, Delft University of Technology, Stevinweg 1, Delft, CN  2628, Netherlands","Nijgh, M.P., Faculty of Civil Engineering and Geosciences, Delft University of Technology, Stevinweg 1, Delft, CN  2628, Netherlands; Gîrbacea, I.A., Faculty of Civil Engineering and Geosciences, Delft University of Technology, Stevinweg 1, Delft, CN  2628, Netherlands; Veljkovic, M., Faculty of Civil Engineering and Geosciences, Delft University of Technology, Stevinweg 1, Delft, CN  2628, Netherlands","Steel-concrete composite beams are widely used in practice because of their simple construction sequence and economic cross-section design. Reuse of traditional composite beams is not possible due to the permanent connection between the steel beam and concrete deck established by welded headed studs. To allow for fast construction, demountability and reuse of composite beams, various demountable shear connectors can be used. In this paper the results of experiments carried out on demountable and reusable tapered composite beams, consisting of a tapered steel beam and large-scale prefabricated concrete decks, are presented. The performance of various arrangements of resin-injected bolt-coupler shear connectors was considered to optimize the beneficial effect of composite action whilst minimizing the number of shear connectors. An advantage of resin-injected bolted shear connectors is that composite action is obtained instantaneously and simultaneously for all connectors. Demountability and reusability of the composite beam were successfully demonstrated experimentally. Experimental and numerical results indicated that the number of shear connectors necessary to fulfil deflection and end-slip limits can be reduced by concentrating them near the supports of a simply-supported beam. Results obtained using finite element models closely matched the experimental results in terms of deflection, stresses and curvature. © 2019 Elsevier Ltd",,"Concretes; Resins; Reusability; Shear flow; Steel beams and girders; Studs (fasteners); Beneficial effects; Construction sequence; Cross section designs; Minimizing the number of; Numerical results; Simply supported beams; Steel concrete composite beam; Tapered composites; Composite beams and girders; composite; concrete structure; elastic property; experimental study; finite element method; numerical model; shear stress; steel structure",Article,"Final","",Scopus,2-s2.0-85059835137
"Nijgh M.P., Veljkovic M.","57199394715;55502801700;","Design of composite flooring systems for reuse",2019,"IOP Conference Series: Earth and Environmental Science","225","1","012026","","",,4,"10.1088/1755-1315/225/1/012026","https://www.scopus.com/inward/record.uri?eid=2-s2.0-85063368363&doi=10.1088%2f1755-1315%2f225%2f1%2f012026&partnerID=40&md5=73f9b2a3e6aa3fa2218c1f1294e20b18","Faculty of Civil Engineering and Geosciences, Delft University of Technology, Delft, Netherlands","Nijgh, M.P., Faculty of Civil Engineering and Geosciences, Delft University of Technology, Delft, Netherlands; Veljkovic, M., Faculty of Civil Engineering and Geosciences, Delft University of Technology, Delft, Netherlands","Composite floor systems are frequently used for high-rise buildings and multi-storey car park buildings, mainly because of the competitive combination of the steel beam and the concrete deck. Traditionally, composite beams are cast in-situ and shear interaction between the concrete and steel beam is provided by welded headed studs. The application of welded headed studs prevents the non-destructive separation of the composite beam, which leads to a very low scoring in the sustainable assessment in terms of the reuse of structural components. An alternative to welded headed studs are bolted shear connectors, which allow for demountability and reusability of a (prefabricated) composite floor system. A key challenge for demountable and reusable composite beams consisting of prefabricated elements is to provide sufficient tolerances to allow for easy execution and demounting, but also to achieve a stiff and strong shear connection under live loads. The required tolerances can, for instance, be obtained by using large bolt-to-hole clearances. The, at first glance, contradictory requirement of a large hole clearance in the execution phase and high stiffness under live loading conditions was solved by using injection bolts. The goal of this paper is to demonstrate how the demountable and composite structures fit in the circular economy framework, and to show that such a demountable and reusable structure was successfully erected and demounted under laboratory conditions. In addition, a cost assessment will be addressed using a simple methodology based on estimated service life (ESL) factors to estimate the annual environmental costs of a composite floor system. © Published under licence by IOP Publishing Ltd.",,"Bolts; Composite beams and girders; Computer software reusability; Concretes; Cost benefit analysis; Cost estimating; Fits and tolerances; Floors; Reusability; Steel beams and girders; Studs (structural members); Tall buildings; Welding; Composite floor systems; Design of composites; Environmental costs; Laboratory conditions; Multi-storey car park; Prefabricated elements; Structural component; Sustainable assessment; Studs (fasteners)",Conference Paper,"Final","",Scopus,2-s2.0-85063368363
"Loqman N., Safiee N.A., Bakar N.A., Nasir N.A.M.","57204421970;45561908700;55364787900;57217211526;","Structural Behavior of Steel-Concrete Composite Beam using Bolted Shear Connectors: A Review",2018,"MATEC Web of Conferences","203",,"06010","","",,4,"10.1051/matecconf/201820306010","https://www.scopus.com/inward/record.uri?eid=2-s2.0-85055467813&doi=10.1051%2fmatecconf%2f201820306010&partnerID=40&md5=678f5f0ec6146b92c565d06fb1c6ccb4","Department of Civil Engineering, Faculty of Engineering, University Putra Malaysia, UPM, Serdang, Selangor, 43400, Malaysia","Loqman, N., Department of Civil Engineering, Faculty of Engineering, University Putra Malaysia, UPM, Serdang, Selangor, 43400, Malaysia; Safiee, N.A., Department of Civil Engineering, Faculty of Engineering, University Putra Malaysia, UPM, Serdang, Selangor, 43400, Malaysia; Bakar, N.A., Department of Civil Engineering, Faculty of Engineering, University Putra Malaysia, UPM, Serdang, Selangor, 43400, Malaysia; Nasir, N.A.M., Department of Civil Engineering, Faculty of Engineering, University Putra Malaysia, UPM, Serdang, Selangor, 43400, Malaysia","Conventional steel-concrete composite beams have been recognized to exhibit stronger structural characteristics, in terms of strength and stiffness, when compared to pure steel or reinforced concrete beams. However, currently most steel beam is fully attached to the concrete slab; this means that the shear connectors are welded through the steel decking on to the steel beam and cast into concrete slab to fulfill the necessary shear connection. Recently, the deconstruction and reuse of the components almost impossible. In order to achieve a sustainable structural system, precast concrete slabs are attached to a steel beam using bolted shear connectors in prefabricated holes have been introduced as an alternative to the conventional connectors in steel - concrete composite beam system. This paper reviews the structural behavior of composite beam system such as the strength, stiffness, slip behavior, failure mode and sustainability obtained by experiment and numerical studies in order to address the applicability and efficiency of the composite beams having precast concrete slabs and bolted shear connectors. © The Authors, published by EDP Sciences, 2018.",,"Bolts; Composite beams and girders; Concrete beams and girders; Concrete slabs; Offshore oil well production; Reinforced concrete; Steel beams and girders; Stiffness; Sustainable development; Composite beam systems; Conventional steel; Reinforced concrete beams; Steel concrete composite beam; Strength and stiffness; Structural behaviors; Structural characteristics; Structural systems; Precast concrete",Conference Paper,"Final","",Scopus,2-s2.0-85055467813
"Wu B., Ji M.","7403590926;56125652200;","Fire Behavior of U-shaped steel beams filled with demolished concrete lumps and fresh concrete",2018,"Applied Sciences (Switzerland)","8","8","1361","","",,4,"10.3390/app8081361","https://www.scopus.com/inward/record.uri?eid=2-s2.0-85051477578&doi=10.3390%2fapp8081361&partnerID=40&md5=db213a03025e2b110987f700c3528f90","State Key Laboratory of Subtropical Building Science, South China University of Technology, Guangzhou, 510640, China","Wu, B., State Key Laboratory of Subtropical Building Science, South China University of Technology, Guangzhou, 510640, China; Ji, M., State Key Laboratory of Subtropical Building Science, South China University of Technology, Guangzhou, 510640, China","To reuse waste concrete in a more straightforward and simplified way, a new kind of structural member containing fresh concrete (FC) and demolished concrete lumps (DCLs) distinctly larger than conventional recycled aggregates has been proposed. Previous research has shown that, at room temperature, the mechanical performance of the U-shaped steel beams filled with DCLs and FC is similar to that of the U-shaped steel beams filled with FC alone. This research explores the fire behavior of the U-shaped steel beams filled with DCLs and FC. Five specimens including three beams filled with DCLs and FC and two reference beams filled with FC alone were tested in fire. The experimental parameters included the replacement ratio of DCLs, the longitudinal reinforcement ratio, the load ratio, and the thickness of fire insulation. Based on the test results, numerical models in which the thermal resistance at the interface between the U-shaped steel and the in-filled concrete is considered are developed using SAFIR to determine the thermal and structural responses of the specimens. Lastly, parametric studies are carried out preliminarily to investigate the effects of some parameters on the fire resistance of such beams. It is found that the replacement ratio of DCLs within a range of 0% to 33% has a very limited effect on the temperature distribution, structural response, and fire resistance of the specimens, that embedding longitudinal reinforcements can significantly increase the fire resistance of such beams, that the interface thermal resistance can generate a temperature drop of up to 280 °C at the interface between the U-shaped steel and the in-filled concrete, and that the numerical models are capable of predicting the thermal and structural responses of such beams. © 2018 by the authors.","Demolished concrete lumps; Fire test; Interface thermal resistance; Numerical models; Structural response; Thermal response; U-shaped steel beam",,Article,"Final","",Scopus,2-s2.0-85051477578
"Nijgh M.P., Veljkovic M., Pavlovic M., Oly R.","57199394715;55502801700;55603154200;56426595400;","Flexible shear connectors in a tapered composite beam optimized for reuse",2018,"Proceedings of the Annual International Conference on Architecture and Civil Engineering","0",,,"","",,1,"10.5176/2301-394X_ACE18.49","https://www.scopus.com/inward/record.uri?eid=2-s2.0-85051723961&doi=10.5176%2f2301-394X_ACE18.49&partnerID=40&md5=bf0fdf9f94365bea9c2056b5e16dc174","Faculty of Civil Engineering and Geosciences, Delft University of Technology, Delft, Netherlands; R and D, Innovation and Methods Astron Buildings S.A, Diekirch, Luxembourg","Nijgh, M.P., Faculty of Civil Engineering and Geosciences, Delft University of Technology, Delft, Netherlands; Veljkovic, M., Faculty of Civil Engineering and Geosciences, Delft University of Technology, Delft, Netherlands; Pavlovic, M., Faculty of Civil Engineering and Geosciences, Delft University of Technology, Delft, Netherlands; Oly, R., R and D, Innovation and Methods Astron Buildings S.A, Diekirch, Luxembourg","Composite beams are frequently used because of their competitive combination of a steel beam and a concrete deck. Further optimization of composite beams is possible through use of tapered steel beams. In terms of material reuse, composite structures generally underperform, because of the concrete casted in-situ. The most common shear connector is the welded headed stud embedded in the concrete. An alternative to welded headed studs is a bolted shear connector, which allows for demountability of the composite floor system and subsequent reuse of it. The goal of this paper is to propose a method to determine the deflection of tapered composite beams with flexible shear connectors. Starting point is the theory available in literature for straight (i.e. prismatic) composite beams with flexible shear connectors. The proposed method is used in a case study to optimize the design of a composite beam in a multi-storey car park. Validation of the derived hand-calculation method is carried out through finite element analysis. An approximation is derived based on which the deflection of tapered composite beams can be estimated through hand calculation, with a deviation less than 5%. Copyright © GSTF 2018.","Composite beam; Design optimization; Finite element analysis; Flexible shear connector; Slip",,Conference Paper,"Final","",Scopus,2-s2.0-85051723961
"Rehman N., Lam D., Dai X., Ashour A.","57188678566;7201749620;36730858000;7005633555;","Testing of composite beam with demountable shear connectors",2018,"Proceedings of the Institution of Civil Engineers: Structures and Buildings","171","1",,"3","16",,7,"10.1680/jstbu.16.00172","https://www.scopus.com/inward/record.uri?eid=2-s2.0-85040711212&doi=10.1680%2fjstbu.16.00172&partnerID=40&md5=b8aa6bac2f5f8b67d53203b976ea46b6","Bradford Centre for Sustainable Environments, School of Engineering, University of Bradford, Bradford, United Kingdom","Rehman, N., Bradford Centre for Sustainable Environments, School of Engineering, University of Bradford, Bradford, United Kingdom; Lam, D., Bradford Centre for Sustainable Environments, School of Engineering, University of Bradford, Bradford, United Kingdom; Dai, X., Bradford Centre for Sustainable Environments, School of Engineering, University of Bradford, Bradford, United Kingdom; Ashour, A., Bradford Centre for Sustainable Environments, School of Engineering, University of Bradford, Bradford, United Kingdom","An experimental study on an innovative composite floor system that can be demounted and deconstructed is described. In this system, the composite slab, formed with profiled metal decking, was connected to a steel beam by way of demountable shear connectors. A full-scale demountable composite floor system (DCFS) was tested to ultimate load-bearing capacity and compared with a similar non-demountable composite floor system specimen using conventional welded headed stud connectors. The experimental results and observations showed that the structural behaviour and load-bearing capacity of both composite floor systems were very similar. However, the composite floor system with demountable shear connectors could be deconstructed after testing and the composite slab could be easily detached from the steel beam. The comparison and analysis presented in this paper indicate that the simple design methods currently provided in Eurocode 4 for welded shear connections could be used to assess the ultimate moment capacity of DCFSs.","Buildings,Structures & design; Composite structures; Recycling & reuse of materials","Bearing capacity; Composite structures; Floors; Loads (forces); Steel beams and girders; Studs (fasteners); Welding; Comparison and analysis; Composite floor systems; Load-bearing capacity; Shear connections; Shear connector; Structural behaviour; Ultimate load-bearing capacity; Ultimate moment capacity; Steel testing; architectural design; bearing capacity; building; composite; recycling; steel structure; structural component",Conference Paper,"Final","",Scopus,2-s2.0-85040711212
"Webster M.D., Wang L., Hajjar J.F.","7202298585;56642669400;34769569000;","Longitudinal shear resistance of Comflor 210",2017,"Composite Construction in Steel and Concrete VIII - Proceedings of the 8th International Conference on Composite Construction in Steel and Concrete, 2017",,,,"251","262",,,,"https://www.scopus.com/inward/record.uri?eid=2-s2.0-85089240782&partnerID=40&md5=39bfaefa925a80ff9bac1c59a5d7055a","Department of Civil and Environmental Engineering, Northeastern University, Boston, MA, United States; Simpson Gumpertz & Heger Inc, Waltham, MA, United States","Webster, M.D., Simpson Gumpertz & Heger Inc, Waltham, MA, United States; Wang, L., Department of Civil and Environmental Engineering, Northeastern University, Boston, MA, United States; Hajjar, J.F., Department of Civil and Environmental Engineering, Northeastern University, Boston, MA, United States","This paper presents the behavior of a sustainable composite steel/concrete floor system under gravity and seismic loading. In this system, precast concrete planks are attached to steel beams using deconstructable clamping connectors, enabling reuse of the structural components and reducing the energy consumption related to material fabrication and waste disposal. The results of several composite beam tests are presented along with the companion pushout tests. In the pushout tests, both monotonic and cyclic load-slip curves were established for the clamping connectors. Full-scale composite beams were then designed and tested to investigate the flexural behavior of the system under gravity loading. © 2020, American Institute of Steel Construction, AISC. All rights reserved.",,"Composite beams and girders; Composite materials; Concrete slabs; Energy utilization; Precast concrete; Waste disposal; Composite steel; Flexural behavior; Gravity loading; Load slip curve; Longitudinal shear resistances; Material fabrication; Seismic loadings; Structural component; Vanadium steel",Conference Paper,"Final","",Scopus,2-s2.0-85089240782
"Nijgh M., Von Arnim M., Pavlović M., Veljković M.","57199394715;57218454549;55603154200;55502801700;","Preliminary assessment of a composite flooring system for reuse",2017,"Composite Construction in Steel and Concrete VIII - Proceedings of the 8th International Conference on Composite Construction in Steel and Concrete, 2017",,,,"263","273",,2,,"https://www.scopus.com/inward/record.uri?eid=2-s2.0-85089233822&partnerID=40&md5=9460095805f73befe7c20bd680bdba30","Delft University of Technology, Delft, Netherlands; Karlsruhe Institute of Technology, Karlsruhe, Germany","Nijgh, M., Delft University of Technology, Delft, Netherlands; Von Arnim, M., Karlsruhe Institute of Technology, Karlsruhe, Germany; Pavlović, M., Delft University of Technology, Delft, Netherlands; Veljković, M., Delft University of Technology, Delft, Netherlands","Composite flooring systems consisting of concrete slabs and steel beams are used extensively, mainly because of competitive design of the cross-section. Shear interaction is often achieved by welded shear studs, which inherently prohibit demountability of the connection and reusability of the individual components. Demountability of composite structures can be achieved by using bolted shear connectors embedded in the concrete. The goal of this paper is to show how such demountable shear connections can be implemented, which allows for easy execution and the reuse of all structural components. A key element in the suggested longitudinal shear device is injection bolts, used to fill the hole clearance with epoxy resin, increasing stiffness and ductility compared to traditional demountable composite structures. Push-out tests and beam tests are planned and pre-analysis is made for these tests using extensive Finite Element modelling. Based on current experience, recommendations for design and execution are made. © 2020, American Institute of Steel Construction, AISC. All rights reserved.",,"Bolts; Composite materials; Concrete beams and girders; Concrete slabs; Floors; Reusability; Structure (composition); Vanadium steel; Composite flooring; Finite element modelling; Individual components; Longitudinal shear; Preliminary assessment; Shear connections; Shear connector; Structural component; Epoxy resins",Conference Paper,"Final","",Scopus,2-s2.0-85089233822
"Liu X., Bradford M.A., Ataei A.","55261897000;7102411221;55891806000;","Flexural performance of innovative sustainable composite steel-concrete beams",2017,"Engineering Structures","130",,,"282","296",,64,"10.1016/j.engstruct.2016.10.009","https://www.scopus.com/inward/record.uri?eid=2-s2.0-84994607950&doi=10.1016%2fj.engstruct.2016.10.009&partnerID=40&md5=90e54be872d1e83feb528645925dac12","Centre for Infrastructure Engineering and Safety, School of Civil and Environmental Engineering, The University of New South Wales, Sydney, NSW  2052, Australia","Liu, X., Centre for Infrastructure Engineering and Safety, School of Civil and Environmental Engineering, The University of New South Wales, Sydney, NSW  2052, Australia; Bradford, M.A., Centre for Infrastructure Engineering and Safety, School of Civil and Environmental Engineering, The University of New South Wales, Sydney, NSW  2052, Australia; Ataei, A., Centre for Infrastructure Engineering and Safety, School of Civil and Environmental Engineering, The University of New South Wales, Sydney, NSW  2052, Australia","Composite beams comprising of concrete slabs and steel beams joined by conventional headed stud shear connectors are commonly used in modern steel-framed building construction. However, because the headed stud shear connectors are welded onto the top flange of the steel beam and cast into the in situ concrete slab, deconstruction of the composite beam and the reuse of its components at the end of structural life in defence to demolition is virtually impossible, which is at odds with the increasing demands placed on improving the sustainability of building infrastructure. As an alternative, an innovative sustainable composite beam and slab system is proposed, in which precast geopolymer concrete panels are attached to the steel beams using high-strength friction-grip bolts instead of cast in situ floors with pre-welded headed stud connectors. The advantages of a low-carbon design, both by the use of geopolymer concrete elements and system deconstructability, can be achieved in this proposed system. In this paper, a three-dimensional finite element model is developed to investigate the structural behaviour of the proposed sustainable composite beam and slab system. Material non-linearities and the interaction of the structural components are included in the model. The accuracy and reliability of the finite element formulation developed are validated by comparisons with experimental results. Extensive parametric studies are conducted to elucidate the effects of the change in the concrete panel configuration, the number and diameter of the bolts, the type and strength of the concrete and the grade of the steel beam on the behaviour of the system. The use of modified rigid plastic analysis is assessed, and a modification is suggested to predict the flexural strengths of the composite beams and slab system. © 2016 Elsevier Ltd","Composite beams; Finite element model; Friction-grip bolt; Geopolymer concrete; Steel and composite structures; Sustainable construction","Beams and girders; Bolts; Carbon; Composite beams and girders; Concrete beams and girders; Concrete buildings; Concrete slabs; Concretes; Connectors (structural); Finite element method; Friction; Geopolymers; High strength steel; Inorganic polymers; Precast concrete; Steel beams and girders; Structural design; Studs (fasteners); Studs (structural members); Sustainable development; Welding; Composite beam; Composite steel concrete beam; Finite element formulations; Geopolymer concrete; Headed stud shear connectors; Steel and composite structures; Sustainable construction; Three dimensional finite element model; Steel castings; concrete structure; finite element method; performance assessment; steel structure; structural component; sustainability",Article,"Final","",Scopus,2-s2.0-84994607950
