Authors,Author(s) ID,Title,Year,Source title,Volume,Issue,Art. No.,Page start,Page end,Page count,Cited by,DOI,Link,Affiliations,Authors with affiliations,Abstract,Author Keywords,Index Keywords,Document Type,Publication Stage,Open Access,Source,EID
"Bielak J., Will N., Becks H., Hegger J., Rempel S.","57193605292;6603797560;57289274300;7004366889;56490429300;","Rehabilitation of a 200 m long pedestrian bridge with carbon textile reinforced concrete",2021,"IABSE Congress, Ghent 2021: Structural Engineering for Future Societal Needs",,,,"101","108",,,,"https://www.scopus.com/inward/record.uri?eid=2-s2.0-85119081327&partnerID=40&md5=cd97fed293460232ef3a5febf7e2fc97","Institute of Structural Concrete, RWTH Aachen University, Aachen, Germany; University of Applied Sciences, Augsburg, Germany","Bielak, J., Institute of Structural Concrete, RWTH Aachen University, Aachen, Germany; Will, N., Institute of Structural Concrete, RWTH Aachen University, Aachen, Germany; Becks, H., Institute of Structural Concrete, RWTH Aachen University, Aachen, Germany; Hegger, J., Institute of Structural Concrete, RWTH Aachen University, Aachen, Germany; Rempel, S., University of Applied Sciences, Augsburg, Germany","The pedestrian and cyclist bridge Rheinsteg of the Rheinkraftwerk Albbruck-Dogern AG (RADAG) constructed in 1934 was on the verge of demolition due to severe corrosion damage. Replacing the defective slab with seven-centimeter thin carbon textile reinforced concrete allowed to maintain the self-weight and to reuse the existing main steel girders, bridge pillars, and foundations. This rehabilitation process globally saved time and cost compared to a new construction. As the existing steel superstructure was again connected monolithically to the new slab to maintain the same level of serviceability, full vertical cracking as well as loads from shrinkage and differential temperature caused by constraint were to be expected. The influence of vertical cracks and tension forces on shear capacity of TRC was investigated during the approval process. This paper presents the project with a focus on TRC and explains insights from the challenging construction on site. © 2021 IABSE Congress, Ghent 2021: Structural Engineering for Future Societal Needs. All rights reserved.","Bridge; Experimental investigation; Rehabilitation; Shear; Slabs; Tension; Textile reinforced concrete","Carbon; Corrosion; Footbridges; Shrinkage; Structural design; Textiles; Corrosion damage; Experimental investigations; Reuse; Self-weight; Severe corrosion; Shear; Slab; Steel girder; Tension; Textile reinforced concretes; Reinforced concrete",Conference Paper,"Final","",Scopus,2-s2.0-85119081327
"Li Q., Shao Z., Liao M.","56911198700;57218107187;8972758300;","A novel vibration-based fault detection approach of bolted engineering structures without reference",2021,"Proceedings of the ASME Turbo Expo","9B-2021",,"V09BT26A002","","",,,"10.1115/GT2021-58493","https://www.scopus.com/inward/record.uri?eid=2-s2.0-85115441440&doi=10.1115%2fGT2021-58493&partnerID=40&md5=1599ad50b6188c38589bf4e08b9c6c31","School of Power and Energy, Northwestern Polytechnical University, Xi'an, China","Li, Q., School of Power and Energy, Northwestern Polytechnical University, Xi'an, China; Shao, Z., School of Power and Energy, Northwestern Polytechnical University, Xi'an, China; Liao, M., School of Power and Energy, Northwestern Polytechnical University, Xi'an, China","Because of some advantages such as low cost, detachability and reusability, bolted joints are widely applied in various open beam-like engineering structures like steel beams and train rails and closed ring-type engineering structures like steel frames and oil pipelines to keep different structural components together. However, bolted engineering structures often encounter vibration-induced joint faults like self-loosening, crack, leakage and corrosion since they are generally subjected to external dynamic loads caused by vibration environments. Joint damages would seriously affect structures' reliability and durability, and increase maintenance costs. Therefore, fault detection of bolted engineering structures is very important and necessary. For beam-like and ring-type engineering structures with single excitation and multiple damaged bolted joints, various methods monitoring changes in nonlinear structural features have been developed. To avoid the use of structural features from benchmark structures for reference during the derivation of damage indicators, a novel vibration-based fault detection approach utilizing features from damaged structures only is proposed in this study. In the new method, the dynamic model of bolted engineering structures is simplified as a general MDOF model with nonlinear elements simulating nonlinear bolt loosening faults. By changing the value of related mass, three similar equations from the damaged structure are used to form one matrix, and then the singularity of matrix is used to detect the existence and position of faults. Results from simulations on the beam-like and ring-type models with multiple damages demonstrate that the proposed approach could be an effective tool to estimate the state of bolted engineering structures. © 2021 American Society of Mechanical Engineers (ASME). All rights reserved.","Beam-like structure; Bolted joint; Fault detection; Ring-type structure","Bolted joints; Bolts; Corrosion; Costs; Damage detection; Dynamic loads; Pipelines; Reusability; Beam-like structures; Damaged structures; Detection approach; Engineering structures; Faults detection; Low-costs; matrix; Ring-type structure; Structural feature; Type structures; Fault detection",Conference Paper,"Final","",Scopus,2-s2.0-85115441440
"Lasky T.A., Swanston T.B., Yen K.S.","6603849668;51562877000;25923668300;","Automated Metadata Cataloging for Mobile Terrestrial Laser Scanning Data Management: Case Study",2021,"Journal of Surveying Engineering","147","1","05020008","","",,,"10.1061/(ASCE)SU.1943-5428.0000330","https://www.scopus.com/inward/record.uri?eid=2-s2.0-85091331166&doi=10.1061%2f%28ASCE%29SU.1943-5428.0000330&partnerID=40&md5=dd6cfbf5fe518655b794759b8eab6424","Dept. of Mechanical and Aerospace Engineering, Univ. of California-Davis, Davis, CA  95616, United States","Lasky, T.A., Dept. of Mechanical and Aerospace Engineering, Univ. of California-Davis, Davis, CA  95616, United States; Swanston, T.B., Dept. of Mechanical and Aerospace Engineering, Univ. of California-Davis, Davis, CA  95616, United States; Yen, K.S., Dept. of Mechanical and Aerospace Engineering, Univ. of California-Davis, Davis, CA  95616, United States","This case study examines two essential aspects of mobile terrestrial laser scanning (MTLS). First, it provides results of an investigation into key data management issues experienced by a fairly large producer/consumer of MTLS data. Second, it documents the requirements, design, and implementation of a software tool for automated metadata cataloging of MTLS data and projects. This tool, known as LidarCrawl, was developed to directly address data management issues encountered in the distribution and reuse of MTLS data. This tool enables a geospatial-enabled web-based portal to view MTLS data availability and improves data discovery and usage for all MTLS user levels. While the current case study focuses on the management of MTLS data for the Department of Transportation, the tool provides a means for automated metadata cataloging for general geospatial data in various domains. © 2020 American Society of Civil Engineers.","Data management; Map-based visualization; Mobile terrestrial laser scanning","Information management; Laser applications; Metadata; Steel beams and girders; Address datum; Data availability; Data discovery; Department of Transportation; Geo-spatial data; Management issues; Terrestrial laser scanning; Web-based portal; Automation; automation; data management; laser method; mapping; metadata; software; spatial data; visualization",Article,"Final","",Scopus,2-s2.0-85091331166
"Kim S., Kim S.-A.","57219913583;25927159900;","Framework for designing sustainable structures through steel beam reuse",2020,"Sustainability (Switzerland)","12","22","9494","1","20",,9,"10.3390/su12229494","https://www.scopus.com/inward/record.uri?eid=2-s2.0-85096054530&doi=10.3390%2fsu12229494&partnerID=40&md5=d9841cfa83eddaa3a6f3de3d54074dda","Department of Convergence Engineering for Future City, Sungkyunkwan University, Suwon, 16419, South Korea; Department of Architecture, Sungkyunkwan University, Suwon, 16419, South Korea","Kim, S., Department of Convergence Engineering for Future City, Sungkyunkwan University, Suwon, 16419, South Korea; Kim, S.-A., Department of Architecture, Sungkyunkwan University, Suwon, 16419, South Korea","The architecture, engineering, and construction sector requires carbon-intensive materials, such as steel, in the construction process and generates a large amount of waste in the life cycle. This causes global warming and waste problems. The demand for the reuse of construction materials is increasing, although it is not the convention, to reduce the environmental impact. Although the sustainable effect of the reuse of materials has been proven in several studies, materials are not always reused in practice, owing to the lack of an information system for reusable materials and the economic uncertainty. In this study, we propose a framework for designing structures using reusable steel beams. The design framework consists of a material bank and a design support tool. The material bank provides information on reusable materials based on the building information modeling. The design support tool generates efficient material procurement plans and provides information about the environmental and economic impact of the project. In a case study used to verify the framework, CO2 emissions were reduced by up to 77% through material reuse, which was consistent with the results of previous studies. However, owing to the cost of processing reusable materials, the overall cost was found to increase by up to about 40%. Therefore, an economic analysis over the entire life cycle when using reusable materials needs to be done. © 2020 by the authors. Licensee MDPI, Basel, Switzerland.","Building information modeling; Design for reuse; Life cycle assessment; Life cycle cost; Material bank; Reuse","carbon emission; construction material; economic analysis; economic impact; environmental impact; global warming; life cycle analysis; recycling; steel; sustainability; uncertainty analysis",Article,"Final","",Scopus,2-s2.0-85096054530
"Arora G., Yadav M., Gaur R., Gupta R., Rana P., Yadav P., Sharma R.K.","57224764054;56647633500;56647759500;57203256901;57201077463;57194462495;57196545594;","A template free protocol for fabrication of a Ni(ii)-loaded magnetically separable nanoreactor scaffold for confined synthesis of unsymmetrical diaryl sulfides in water",2020,"RSC Advances","10","33",,"19390","19396",,9,"10.1039/d0ra02287j","https://www.scopus.com/inward/record.uri?eid=2-s2.0-85085661594&doi=10.1039%2fd0ra02287j&partnerID=40&md5=4523106a6cdebc8503e3b4d76db9c999","Green Chemistry Network Centre, Department of Chemistry, University of Delhi, Delhi, 110007, India; Department of Chemistry, Hindu College, University of Delhi, Delhi, 110007, India","Arora, G., Green Chemistry Network Centre, Department of Chemistry, University of Delhi, Delhi, 110007, India; Yadav, M., Green Chemistry Network Centre, Department of Chemistry, University of Delhi, Delhi, 110007, India, Department of Chemistry, Hindu College, University of Delhi, Delhi, 110007, India; Gaur, R., Green Chemistry Network Centre, Department of Chemistry, University of Delhi, Delhi, 110007, India; Gupta, R., Green Chemistry Network Centre, Department of Chemistry, University of Delhi, Delhi, 110007, India; Rana, P., Green Chemistry Network Centre, Department of Chemistry, University of Delhi, Delhi, 110007, India; Yadav, P., Green Chemistry Network Centre, Department of Chemistry, University of Delhi, Delhi, 110007, India, Department of Chemistry, Hindu College, University of Delhi, Delhi, 110007, India; Sharma, R.K., Green Chemistry Network Centre, Department of Chemistry, University of Delhi, Delhi, 110007, India","In the present report, an environmentally benign magnetically recoverable nickel(ii)-based nanoreactor as a heterogeneous catalyst has been developedviaa template free approach. The catalytic performance of the synthesized catalyst is assessed in the confined oxidative coupling of arenethiols with arylhydrazines to form unsymmetrical diaryl sulfides under aerobic conditions. The salient features of our protocol include oxidant- and ligand-free conditions, use of water as a green solvent, room temperature and formation of nitrogen and water as the only by-products. Moreover, a broad range of functional groups are tolerated well and provide the corresponding diaryl sulfides in moderate to good yields. Moreover, the heterogeneous nature of the catalyst permits facile magnetic recovery and reusability for up to seven runs, making the present protocol highly desirable from industrial and environmental standpoints. © The Royal Society of Chemistry 2020.",,"Isomers; Nanocatalysts; Nanoreactors; Reusability; Scaffolds (biology); Steel beams and girders; Sulfur compounds; Catalytic performance; Confined synthesis; Environmental standpoint; Environmentally benign; Heterogeneous catalyst; Magnetic recovery; Magnetically separable; Oxidative couplings; Nickel compounds",Article,"Final","",Scopus,2-s2.0-85085661594
"Du H., Hu X., Meng Y., Han G., Guo K.","57195421909;55496178300;57215187133;57215204456;57210583205;","Study on composite beams with prefabricated steel bar truss concrete slabs and demountable shear connectors",2020,"Engineering Structures","210",,"110419","","",,16,"10.1016/j.engstruct.2020.110419","https://www.scopus.com/inward/record.uri?eid=2-s2.0-85080084821&doi=10.1016%2fj.engstruct.2020.110419&partnerID=40&md5=be9da524a84b2b10f234b4fd9a262f7b","College of Civil Engineering, Nanjing Tech University, Nanjing, 211816, China","Du, H., College of Civil Engineering, Nanjing Tech University, Nanjing, 211816, China; Hu, X., College of Civil Engineering, Nanjing Tech University, Nanjing, 211816, China; Meng, Y., College of Civil Engineering, Nanjing Tech University, Nanjing, 211816, China; Han, G., College of Civil Engineering, Nanjing Tech University, Nanjing, 211816, China; Guo, K., College of Civil Engineering, Nanjing Tech University, Nanjing, 211816, China","In the conventional steel-concrete composite beams, the composite action is achieved by welded stud connectors which are encased into the cast-in-place concrete slab. This makes the deconstruction and reuse of the structural components almost impossible. A sustainable and prefabricated composite structural system was developed in this study wherein the steel beam is attached to the prefabricated steel-bars truss concrete slab using the demountable bolted connectors. Twelve push-out specimens were designed and tested to assess the shear behavior of the bolted connectors. The test results showed that the shear bearing capacity of the bolted connectors with the prefabricated steel-bars truss concrete slab increased 7.0% over that of the bolted connectors with the prefabricated normal concrete slab. Three full-scale composite beams with various shear connection ratios were constructed and loaded to failure. For direct comparison, a similar composite beam was constructed with the same section size and shear connectors, but using the cast-in-place concrete slab. The flexural capacity of the composite beams with 68% shear connection and full shear connection increased 9.8% and 15.8% compared to the composite beam with 46% shear connection, respectively. The mechanical behavior of the composite beam with the prefabricated concrete slab was comparable with that of the composite beam with cast-in-place concrete slab. The load carrying capacity of the composite beam can be predicted by the simplified model in Eurocode 4 and the plastic model. © 2020 Elsevier Ltd","Composite beam; Demountable shear connector; Load carrying capacity; Prefabricated; Push-out test; Steel bar truss concrete slab","Bars (metal); Bolts; Cast in place concrete; Composite beams and girders; Concrete beams and girders; Connectors (structural); Load limits; Loads (forces); Trusses; Composite beam; Prefabricated; Push-out tests; Shear connector; Steel bars; Concrete slabs; bearing capacity; building code; composite; concrete; shear strength; steel structure; testing method",Article,"Final","",Scopus,2-s2.0-85080084821
"Nijgh M.P.M., Veljkovic M.M.","57199394715;55502801700;","Requirements for oversized holes for reusable steel-concrete composite floor systems",2020,"Structures","24",,,"489","498",,6,"10.1016/j.istruc.2020.01.021","https://www.scopus.com/inward/record.uri?eid=2-s2.0-85078988463&doi=10.1016%2fj.istruc.2020.01.021&partnerID=40&md5=674e074dd889650b8303fc1c54d35c08","Faculty of Civil Engineering and Geosciences, Delft University of Technology, Delft, Netherlands","Nijgh, M.P.M., Faculty of Civil Engineering and Geosciences, Delft University of Technology, Delft, Netherlands; Veljkovic, M.M., Faculty of Civil Engineering and Geosciences, Delft University of Technology, Delft, Netherlands","The design of sustainable structures is increasingly gaining attention in the construction sector as a societal and technological challenge. Demountability and reuse of structures contributes to the reduction of the environmental impact of the built environment. Welded headed studs used in traditional steel-concrete composite floor systems need to be replaced by demountable shear connectors to enable the transition of the construction sector to a circular business model. The demountable shear connectors are embedded in large prefabricated concrete floor elements and connected to steel beams by bolts. The holes in the beam flange are oversized to account for geometrical and dimensional deviations of all members and to facilitate rapid execution and easy demounting. The goal of this paper is to present a methodology that quantifies the required nominal hole clearance for reusable composite floor systems. Statistical characteristics of dimensional and geometrical deviations serve as input for Monte-Carlo simulations. The aggregated results of the Monte Carlo simulations are used to determine the required nominal hole clearance for a specified probability of successful installation of the demountable shear connectors. The proposed methodology is applied to the composite floor system of a demountable and reusable car park building. The contradicting requirement of oversized holes and composite interaction is solved by injecting the hole clearance with a (steel-reinforced) epoxy resin. The bearing resistance of the (steel-reinforced) epoxy resin is addressed based on preliminary results of creep experiments on resin-injected bolted connections. © 2020 Institution of Structural Engineers","Bearing strength; Composite floor system; Deviation; Resin-injected bolted connection; Sustainability",,Article,"Final","",Scopus,2-s2.0-85078988463
[No author name available],[No author id available],"Proceedings of the 9th International Conference on Advances in Steel Structures, ICASS 2018",2020,"Proceedings of the 9th International Conference on Advances in Steel Structures, ICASS 2018",,,,"","",2091,,,"https://www.scopus.com/inward/record.uri?eid=2-s2.0-85085128940&partnerID=40&md5=bcb67f0fa6001445b29b5a9e7f555e42",,"","The proceedings contain 180 papers. The topics discussed include: progressive collapse resistance of steel framed buildings under extreme events; modeling systems of unsymmetrical sections as doubly symmetric â€“ how much does it matter?; opportunities for metal 3D printing in structural engineering; designing composite structures for reuse; innovation in modular building construction; advances in steel-concrete composite structures: Australian experiences; full-range behavior of semi-rigid steel connections; designing steel structures with 3D connections; electro-slag weld fractures in seismic steel beam-to-box column moment connections; and push-out tests on circular concrete-filled doubleskin steel tubular columns.",,,Conference Review,"Final","",Scopus,2-s2.0-85085128940
"Nikoofar K., Haghighi M., Khademi Z.","7801504403;23392488700;56845827700;","Preparation, characterization, and catalytic application of metallic nanocrystalline MgAl2O4 in the synthesis of 3-hydroxy-3-indolyl-indolin-2-ones, symmetrical and unsymmetrical 3,3′-bis(indolyl)indolin-2-ones, and 3,3′-bis(indolyl)methanes",2019,"Arabian Journal of Chemistry","12","8",,"3776","3784",,6,"10.1016/j.arabjc.2016.01.013","https://www.scopus.com/inward/record.uri?eid=2-s2.0-85041083067&doi=10.1016%2fj.arabjc.2016.01.013&partnerID=40&md5=02a88eef1149272084ba202d2169ea77","Department of Chemistry, Faculty of Physics and Chemistry, Alzahra University, Vanak, Tehran, P.O. Box Number 1993893973, Iran","Nikoofar, K., Department of Chemistry, Faculty of Physics and Chemistry, Alzahra University, Vanak, Tehran, P.O. Box Number 1993893973, Iran; Haghighi, M., Department of Chemistry, Faculty of Physics and Chemistry, Alzahra University, Vanak, Tehran, P.O. Box Number 1993893973, Iran; Khademi, Z., Department of Chemistry, Faculty of Physics and Chemistry, Alzahra University, Vanak, Tehran, P.O. Box Number 1993893973, Iran","Nanocrystalline MgAl2O4 has been synthesized via co-precipitation method and characterized by Fourier transform infrared spectroscopy (FT-IR), energy-dispersive X-ray spectroscopy (EDX), scanning electron microscopy (SEM), and X-ray diffraction (XRD) techniques. The synthesized nanocatalyst has been utilized for the one-pot condensation of indoles and isatins to prepare 3-hydroxy-3-indolyl-indolin-2-ones and symmetrical and unsymmetrical 3,3′-bis(indolyl)-indolin-2-ones. The one-pot pseudo three-component condensation of indoles and various aldehydes has also been examined to afford 3,3′-bis(indolyl)methanes. Short reaction times, reusability and recovery of the nanocatalyst, in addition to solvent-free reaction media are some advantages of this eco-friendly procedure. © 2019","MgAl2O4; Multi-component reaction (MCR); Nanocatalyst; Oxindoles","Aluminum compounds; Condensation; Energy dispersive spectroscopy; Fourier transform infrared spectroscopy; Methane; Nanocatalysts; Nanocrystals; Precipitation (chemical); Reusability; Scanning electron microscopy; Steel beams and girders; Catalytic applications; Coprecipitation method; Energy dispersive X ray spectroscopy; Fourier transform infra red (FTIR) spectroscopy; MgAl2O4; Multi-component reactions; Nano-catalyst; Oxindoles; Magnesium compounds",Article,"Final","",Scopus,2-s2.0-85041083067
"Rezvanisharif M., Ketabi M.S.","57209197485;57209200341;","Fe modeling and seismic performance evaluation of hybrid sma-steel rc beam-column joints",2019,"Latin American Journal of Solids and Structures","16","5","e192","","",,2,"10.1590/1679-78255272","https://www.scopus.com/inward/record.uri?eid=2-s2.0-85066783191&doi=10.1590%2f1679-78255272&partnerID=40&md5=73071fc51844ec486219510a666274dd","Civil Engineering Faculty, K. N. Toosi University of Technology, Tehran, Iran","Rezvanisharif, M., Civil Engineering Faculty, K. N. Toosi University of Technology, Tehran, Iran; Ketabi, M.S., Civil Engineering Faculty, K. N. Toosi University of Technology, Tehran, Iran","Severe permanent deformations of buildings during earthquakes have been found as one of the major causes of the instability and failure of structures. The application of superelastic Shape Memory Alloy rebars at the plastic hinge region of reinforced concrete beam-column joints (SESMA-BCJs) can eliminate the seismic residual deformations. Such self-centering structures can maintain their reusability even after severe earthquakes. This research proposes a simple-yet practical-technique for more accurate modeling of SESMA-BCJs using VecTor2 software. Both material and geometric nonlinearity were considered. Efficiency and versatility of the modeling approach were verified against a number of test results at both material and structural levels. According to the results, the adopted modeling approach can be reliably used for the prediction of the cyclic response of hybrid SESMA-BCJs under changing various design parameters which are beyond the scope of the experimental tests. Furthermore, using the calibrated model, a comprehensive seismic parametric study was conducted to investigate the influence of various design parameters on the seismic performance of SESMA-BCJs. Finally, a new Fe-based SESMA-BCJ with a lower amount of SESMA and higher seismic performance than NiTi-based BCJs was introduced and numerically investigated. © 2019, Brazilian Association of Computational Mechanics. All rights reserved.","Hybrid SMA-steel beam-column joint; Nonlinear FE modeling; Self-centering; Shape memory alloy; Smart material","Concrete beams and girders; Deformation; Earthquakes; Intelligent materials; Reinforced concrete; Reusability; Seismic design; Seismic waves; Shape memory effect; Shape-memory alloy; Geometric non-linearity; Non-linear FE; Permanent deformations; Reinforced concrete beam-column joints; Seismic performance evaluation; Self centering; Steel beam columns; Superelastic shape memory alloy; Failure (mechanical)",Article,"Final","",Scopus,2-s2.0-85066783191
