,Authors,Article Title,Document Type,Author Keywords,Abstract,DOI,DOI Link
91,"Marsh, ATM; Velenturf, APM; Bernal, SA",Circular Economy strategies for concrete: implementation and integration,Article,,"Concrete is the world's most widely-used anthropogenic material, and Circular Economy strategies will be key to addressing the myriad challenges that face its use today and into the future. Despite a rapid growth of research interest in developing Circular Economy strategies for concrete, this has mostly focussed on technical and environmental issues at the material and product scale. Holistic approaches considering wider social and political aspects as well as system-scale perspectives have been relatively neglected. This article uses a narrative review to investigate three outstanding questions to help address this gap: how concrete's material, product and system scale attributes influence the interpretation of Circular Economy principles; how the full range of Circular Economy strategies can be implemented for concrete; and what the likely implementation issues will be when integrating different Circular Economy strategies (such as design for durability, component reuse and material recycling). From a product-scale perspective, it is argued that greater specificity is needed around the growing diversity of concrete materials and products in Circular Economy discourse their properties are often distinct and hence specific strategies are not necessarily universally applicable. At the same time, a solely product-centric Circular Economy perspective is insufficient for concrete, and only joint consideration of structural and systemic perspectives will yield satisfactory solutions. 'Soft' perspectives of social, political and legal aspects cannot be viewed simply as an added bonus, but are essential to reconciling the 'hard' issues of technical, environmental and economic aspects that dominate discussions. Whilst concrete can and should have a key role in a Circular Economy, its success will require more than just extensions of linear economy thinking.",10.1016/j.jclepro.2022.132486,0.0
67,"Allan, K; Phillips, AR",Comparative Cradle-to-Grave Life Cycle Assessment of Low and Mid-Rise Mass Timber Buildings with Equivalent Structural Steel Alternatives,Article,,"The objective of this paper was to quantify and compare the environmental impacts associated with alternative designs of typical North American low and mid-rise buildings. Two scenarios were considered: a traditional structural steel frame or an all-wood mass timber design, utilizing engineered wood products for both gravity and lateral load resistance. The boundary of the quantitative analysis was cradle-to-grave with considerations taken to discuss end-of-life and material reuse scenarios. The TRACI methodology was followed to conduct a Life Cycle Impact Assessment (LCIA) analysis that translates building quantities to environmental impact indicators using the Athena Impact Estimator for Buildings Life Cycle analysis software tool and Athena's Life Cycle Inventory database. The results of the analysis show that mass timber buildings have an advantage with respect to several environmental impact categories, including eutrophication potential, human health particulate, and global warming potential where a 31% to 41% reduction was found from mass timber to steel designs, neglecting potential carbon sequestration benefits from the timber products. However, it was also found that the steel buildings have a lower impact with respect to the environmental impact categories of smog potential, acidification potential, and ozone depletion potential, where a 48% to 58% reduction was found from the steel to the mass timber building designs.",10.3390/su13063401,0.0
107,"Lee, S; Yu, JH",Comparative Study of BIM Acceptance between Korea and the United States,Article,,"Substantial research has been performed on data standards and exchanges in the AEC/FM (Architecture, Engineering, Construction and Facilities Management) industry over the past several years. The growing popularity of Building Information Modeling (BIM) technology is based heavily on the perception that it can facilitate the sharing and reuse of information during a project's lifecycle. Although many researchers and practitioners are in agreement about the potential applicability and benefit of BIM in construction, it is still unclear why BIM is adopted, and what factors enhance the implementation of BIM. Thus, BIM acceptance and use remains a central concern of BIM research and practice. BIM was accepted in the United States earlier than in Korea, and BIM users are expected to have a higher maturity and positive perception about utilizing BIM depending on a lengthier utilization period. This means that the mechanism for achieving acceptance of BIM in Korea differs from the mechanism in the United States. Therefore, Korea's BIM acceptance model was compared to that in the United States using structural equation modeling. The key components, including the BIM acceptance model, were identified through a literature review of the Technology Acceptance Model (TAM) and related theories and was consolidated by interviews and pilot studies with professionals in the construction industry. Based on these components, a questionnaire was designed and sent out to workers in construction organizations (such as contractors, architects, construction managers, engineers, and facility managers) in Korea and the United States. A total 164 completed questionnaires were retrieved. Structural equation modeling for hypothesis testing was conducted using commercially-available software. The results from this study can serve as a foundation for research looking into the organizational context to further BIM acceptance in the construction industry. The comparison of the mechanism and subsequent results will serve as a guideline for developing an acceptance strategy that is suitable for Korea. (C) 2015 American Society of Civil Engineers.",10.1061/(ASCE)CO.1943-7862.0001076,0.0
99,"Hasik, V; Escott, E; Bates, R; Carlisle, S; Faircloth, B; Bilec, MM",Comparative whole-building life cycle assessment of renovation and new construction,Article,,"Renovation of existing buildings has been identified as a major strategy for reducing the environmental impacts associated with building construction. From the perspective of embodied impacts, repurposing existing structures can reduce the amount of new materials that have to be extracted, manufactured, and installed. While the literature on energy efficiency retrofitting is relatively abundant, a smaller number of studies investigate the differences in whole-building embodied impacts of major renovations. This study presents an approach for conducting a whole-building life cycle assessment (LCA) on building renovation projects, suggests an approach for conducting comparative assessments between renovation and new construction, and demonstrates the approach on an adaptive reuse case study. The approach consists of comparing the full life cycle impacts of the existing building to the sum of the life cycle impacts of the components added in the renovation and the maintenance and replacement needs of the existing/reused components. The case study showed 53-75% reductions across 6 different environmental impact categories when the renovation was compared to a new construction scenario. The reuse of the structural and envelope components provided the majority of the reductions, as most of the renovation was of the interior components and finishes. The presented work can be used as a model for consistent LCAs on other renovation projects and to show designers, policy makers, and building owners the environmental benefits of adaptive reuse over new construction as a result of reduced need for new building materials.",10.1016/j.buildenv.2019.106218,0.0
139,"Krohnert, H; Itten, R; Stucki, M",Comparing flexible and conventional monolithic building design: Life cycle environmental impact and potential for material circulation,Article,,"Due to severe sustainability problems caused by the built environment, calls for adopting circular economy principles in building design, such as flexibility and reversibility, are increasing. However, there is still a lack of quantitative studies on the corresponding environmental benefits in this regard. In the present study, a life cycle assessment of a multi-storey residential reference building is carried out, comparing a flexible, reversible building design using a load-bearing steel structure and wooden ceiling elements to a conventional, monolithic design based on reinforced concrete. The assessment is carried out on a whole building level, including construction, operation, maintenance, and the end-of-life phase. Both building designs show similar results for a regular life cycle of 60 years without major refurbishment (13 and 14.5 kg CO2-eq/m(2) per operational year). When longer building lifetimes are considered, the environmental impact of the reference building per operational year decreases significantly. In this context, flexible building design is advantageous as it facilitates the refurbishment of buildings, while monolithic building design often leads to premature demolition due to low adaptability. Further advantages of reversible building design include the increased potential of materials to be recirculated at the end-of-life stage of a building and in the potential reuse of structural elements. This study shows that 14% of the embodied greenhouse gas emissions of the flexible building can be avoided if the foundation, load-bearing structure and ceiling elements are kept in place for a subsequent building. Such direct reuse leads to a substantially higher environmental value retention than recycling of the same materials.",10.1016/j.buildenv.2022.109409,0.0
80,"Griffin, CT; Reed, B; Hsu, S",Comparing the embodied energy of structural systems in buildings,Proceedings Paper,,"There are a number of factors that typically influence the selection of a structural system including code, cost, construction schedule and site constraints. As sustainability increasingly becomes an important goal during the design process, the role of structure in the overall sustainability of a building will need to be considered in terms of embodied energy, building longevity, reuse and deconstruction. The structure of a typical office building contributes roughly one-third to one-quarter of the total embodied energy and double the amount contributed by interior finishes. Consequently, the structure of a building should be a primary target for reducing the embodied energy of a building. While there has been much research on the embodied energy of structural materials, there has been less research into comparing the embodied energy of structural systems. Life-cycle analysis (LCA) tools exist to calculate the embodied energy of a proposed structural system during the early stages of the design process. However, the over simplified nature of these tools can provide misleading conclusions about which structural materials and systems will have the lowest environmental impact. To allow architects and engineers to consider issues of sustainability in the design and selection of a structural system, a transparent and easily understood metric for comparing the embodied energy of structural systems is required. In order to better understand the relationship between structural systems and embodied energy, this paper examines the embodied energy of materials used in typical steel and reinforced concrete structural systems by calculating the amount of material needed for different systems and the embodied energy of selected bay sizes. This method accounts for the varying size and amount of material needed for different spans and columns sizes. By using bay sizes, alternative structural systems are more easily compared to one another. Finally, a 4-story laboratory building, in design at the University of Oregon in Eugene, Oregon, was used as a case study to test the use of bay sizes as a comparative tool. Using schematic plans furnished by the architects to identify the bay sizes used in the building, a one-way concrete slab and beam or one-way joist slab proved to be the structural systems with the lowest embodied energy (both approximately 5,000 GJ).",,
241,"Unver, H; Alptekin, O; Kalkan, M",Comparison of the building adaptability assessment models: a semi-systematic review,Review; Early Access,,"Purpose Adaptability studies in the literature include repetitive models and completely independent new model proposals. As a result of the evaluation of these studies, the lack of analysis studies based on a certain algorithm was determined. In this context, in this study, existing models are evaluated in order to contribute to future studies in the context of adaptability. This study is presented as a guide for new studies in the context of adaptability. Design/methodology/approach In the study, first of all, the change of the concept of adaptability in the historical process was investigated by literature review from 1958 to the present. Then, a comparative analysis of the existing adaptability models used in architecture between the years 2007-2020 was made in the context of the main and sub-criteria obtained in the literature research. Findings In the study, the concept of adaptability, the definition of building adaptability and the analysis of adaptability models were examined and findings were obtained under three main headings. The definition of adaptability takes place in the literature on a multidisciplinary scale. In the definition of adaptability, it should cover not only structural but also functional, economic, technological and performance-oriented strategies applied to structures. Although the theories examined within the scope of building adaptability are seen as a guide for future studies, they should be supported by examples that can be applied in a global context. In the study, 7 adaptability models determined by a semi-systematic literature review were analyzed. The matrices of the models based on the adaptability sub-criteria are discussed in the context of scenario, physical life, openness, physical use, barriers and obsolescence. The data obtained is a guide for the models to be used in the future within the scope of adaptability. Originality/value This study presents a semi-systematic analysis of the studies in the literature on the adaptability of structures. In this context, the study serves as a guide for adaptability models to be designed in the future.",10.1108/IJBPA-01-2022-0013,0.0
264,"Andreasen, MM",Conceptual design capture - Keynote paper,Proceedings Paper,,"This paper present a basic theory of mechanical systems design, the so-called domain theory. By a strict distinction between structural characteristics and behavioural properties, each domain becomes a strong view for synthesis of the artefact. The functional reasoning in each domain and between the domains seems to be ruled by the Function/Means-Law (Hubka's law). Different enhancing viewpoints of the Function/Means-Law are presented.",,
46,"Wu, YM; Kimura, F",Conceptual design of product structure for parts reuse,Proceedings Paper,,End-of-life products are taken back constrainedly by the laws and disassembled to a mass of reusable parts. Design for reusing these taken-back parts into new products has more constraints than conventional design. A new method based on the set theory and constraint digraph is proposed to model design for taken-back parts reuse and to get all feasible designs. The eco-cost which considers product cost and eco-efficiency of parts reuse concurrently is applied to get an optimal design. A structural design of stamping mold is examined as a case for the validity of the proposed method.,10.1007/978-1-84628-935-4_7,0.0
61,"Wang, JG; Jiang, N",Conservation and adaptive-reuse of historical industrial building in China in the post-industrial era,Article,,"The conservation and adaptive-reuse of historical industrial building is one of the most important issues to be solved in today's urban development and construction in China. In this paper, the necessity and academic meaning of the conservation and adaptive-reuse of historical industrial building were discussed by reviewing its development rend both at home and abroad, and the basic contents of the implementation of the conservation and adaptive-reuse of historical industrial building in China with specific cases provided were analyzed. It is the central task for China to put forward the restructuring and design methods, assessment principles and relevant core technical specifications based on the empirical researches on the historical industrial building and site.",10.1007/s11709-007-0064-5,0.0
4,"Keller, P; McConnell, J; Schumacher, T; Thostenson, ET",Construction Stress Monitoring Using a Wireless Sensor Network to Evaluate Reuse Potential of Structural Steel,Article,,"Stresses in structural steel members of steel-framed buildings during construction are difficult to predict with certainty using conventional engineering methods. In order to inform current design practices and provide information to partially evaluate if a steel member can be reused after its service life, construction-induced strains in a typical building were recorded. Specifically, two columns and three Beams of a four-story steel-framed building were instrumented prior to delivery to the construction site using a wireless sensor network. Data were recorded for 48 days, while the structure was erected and the concrete deck poured, up to fireproofing the building. The data were analyzed considering dead load force effects during various construction phases, impacts, and temperatures. The analysis revealed high variations in temperature throughout the structure and consequently significant temperature-induced stresses as well as greater magnitudes of flexural stress in columns than expected. As a result, the recorded stresses differed by 1-120 MPa (0-18 ksi) compared to the theoretically predicted stresses. Yet, the maximum measured stress [160 MPa (23.2 ksi)] was only 46% of the nominal yield strength. Measured stresses were also used to calculate member forces, and the combined member forces resulted in a maximum of 55% of the yield limit. Thus, the results validated current design practices and the possibility of reusing structural steel.",10.1061/(ASCE)ST.1943-541X.0002384,0.0
87,"Kolaventi, S; Tadepalli, T; Mom, H; Kumar, MVNS",Construction waste in India: a structural equation model for identification of causes,Article,,"Construction industries are bulk generators of waste globally; improper management leads to environmental catastrophes. This paper identifies the significant factors through exploratory factor analysis and presents a novel approach to determining the causal relationships of various factors that lead to waste generation at construction sites by structural equation modelling. The analysis identifies maintaining and managing a site waste-management plan (SMP) as the top factor, with a path coefficient of 0.96. The impacts on waste generation of factors such as the operation stage (0.91), ordering and purchasing stage (0.84), hauling and handling stage (0.76), material handling stage (0.73), documentation (0.60) and culture (0.46) are quantified. Appropriate documentation provides the framework for SMP, on the basis of which other mitigation measures may be enforced, thus reinforcing the analysis results of SMP variables. Standardised documentation procedures for SMP need to be initiated and incentivised within existing green building performance rating frameworks, such as Green Rating for Integrated Habitat Assessment and Leadership in Energy and Environmental Design-India.",10.1680/jensu.19.00047,0.0
20,"Bertin, I; Lebrun, F; Braham, N; Le Roy, R","Construction, deconstruction, reuse of the structural elements: the circular economy to reach zero carbon",Proceedings Paper,,"The research work presented aims at setting up an infinite cycle of use of materials by their reuse and answering in particular to the problems of circular economy. Structural work and foundations represent the majority of the embodied energy of a building. The research effort is therefore focused on the structural elements. Reuse is here defined as the reuse of an element without transformation, unlike recycling which induces a new industrial cycle. It is therefore about reducing the consumption of materials and lowering GHG emissions. Today, it is impossible in France to reuse structures because of responsibilities, insurance and lack of traceability. How to make possible the reuse of structural components in order to reach a low carbon building? The challenge of this work is to find the best structural configuration making the components reuse easier at the EOL. The methodology we are implementing aims to design the structural elements by increasing the BIM parameters (6D, LCA), to attach the mechanical information, material durability, ageing to each object of the digital mock-up. A digital and physical traceability makes it possible to follow the evolution of the element over the years and to feed a database. At the end of its life the database is accessible and searchable for the design of a future building. A development of tools and gateways will then allow from a model of calculation to go to query the database to find an element resulting from the deconstruction that can be reused in the future structure.",10.1088/1755-1315/323/1/012020,0.0
179,"Ranta, V; Aarikka-Stenroos, L; Makinen, SJ",Creating value in the circular economy: A structured multiple-case analysis of business models,Article,,"The circular economy (CE) has gained traction as a pathway towards more sustainable economic growth. The main actions leading towards a CE have been identified as the 3R principles of reduce, reuse, and recycle. However, understanding is lacking regarding how the adoption of CE using the 3R principles generates value and revenue in a business context. Thus, this study structurally examines business models used by CE-driven firms utilizing the fundamental business model components of value proposition, value creation/delivery, and value capture. By developing a detailed framework of business model components, acknowledging the particular features of CE implementation, and conducting a multiple-case study combining the business model approach with the 3R principles, this study analyzes feasible CE business models from multiple industries in Europe, the US, and China. The following five research propositions are derived from the findings of the explorative case analysis: 1) the cost-efficiency of circular operations is the key proponent to successful CE business, 2) take-back services enable the acquisition of particular wastes as resources, but they need to be incentivized through reductions in customers' total waste management costs, 3) circular business models require the focal firm to separately manage multiple positions in the value chain, 4) the take-back system for gaining value through CE can be implemented successfully in multiple ways, and 5) recycling is easier to implement than reducing or reusing due to a smaller impact on the business. These propositions contribute to the circular business model literature by showing how economic value is generated by CE initiatives and providing foundations for theory-testing future research. The propositions also provide guidance for policymakers and managers on supporting and implementing circular business. (C) 2018 Elsevier Ltd. All rights reserved.",10.1016/j.jclepro.2018.08.072,0.0
71,"Hasnain, H; Mohseni, F",Creative ideation and adaptive reuse: a solution to sustainable urban heritage conservation,Proceedings Paper,,"The rapid phenomenon of urbanization in the last century has resulted in abandonment of historic urban centers and still today attracting people to suburbs and newly developed districts. This urban expansion poses a serious threat to historic properties when people opt to move away leaving behind their heritage. The adaptive reuse of heritage is considered to be a dominant strategy for handling this issue bypassing demolition of heritage properties. However, the adaptive reuse cannot only consider the preservation of the heritage as the structural retrofit or functional revitalization but rather it needs to enunciate the image and the creative ideation that reflect upon the future of heritage. Consequently, this paper aims to examine the role of branding as an innovative source of ideation in the implication of adaptive reuse on heritage. In this regards, the case study of Zalando outlet store in Berlin is selected, which is an old building situated in the commercial district of the city in a wide range of styles and heritage buildings from the middle ages. This research uses semi-structured interviews to examine the significance of Brand making in a successful adaptive reuse process. The findings indicate that the importance of the outlet building lies not only in its physical fabric or commercial aspects, but the spirit of the place that lies in the magical essence of big labels as emblems. This underlying essence of place stimulated the adaptation of building in a way that it surpasses the physical and functional aspect of a building and makes it merge in new times and new sustainable development.",10.1088/1755-1315/126/1/012075,0.0
