,Authors,Article Title,Document Type,Author Keywords,Abstract,DOI,DOI Link
3,"Akhras, G; Cheung, MS; Li, WC",Finite strip post-buckling analysis of steel girder under pure bending,Proceedings Paper,,"In the present study, the elasto-plastic post-buckling analysis of prismatic steel girders subjected to pure bending is conducted using the finite strip method. The effects of both the initial geometrical imperfections and residual stresses due to fabrication are included in the combined geometrically and materially nonlinear simulation. The von-Mises yield criterion and the Prandtl-Reuss flow theory of plasticity are applied in modeling the elasto-plastic behavior of the material. The Newton-Raphson iteration is carried out as the rotation of the end cross sections of the structure is increased step-by-step. The proposed method is employed to predict the ultimate strength of a ship's hull model. The results compare favorably with the experiment data.",,
13,"Liu, XP; Bradford, MA; Ataei, A",Flexural performance of innovative sustainable composite steel-concrete beams,Article,Composite beams; Sustainable construction; Friction-grip bolt; Geopolymer concrete; Finite element model; Steel and composite structures,"Composite beams comprising of concrete slabs and steel beams joined by conventional headed stud shear connectors are commonly used in modern steel-framed building construction. However, because the headed stud shear connectors are welded onto the top flange of the steel beam and cast into the in situ concrete slab, deconstruction of the composite beam and the reuse of its components at the end of structural life in defence to demolition is virtually impossible, which is at odds with the increasing demands placed on improving the sustainability of building infrastructure. As an alternative, an innovative sustainable composite beam and slab system is proposed, in which precast geopolymer concrete panels are attached to the steel beams using high-strength friction-grip bolts instead of cast in situ floors with pre-welded headed stud connectors. The advantages of a low-carbon design, both by the use of geopolymer concrete elements and system deconstructability, can be achieved in this proposed system. In this paper, a three-dimensional finite element model is developed to investigate the structural behaviour of the proposed sustainable composite beam and slab system. Material non-liriearities and the interaction of the structural components are included in the model. The accuracy and reliability of the finite element formulation developed are validated by comparisons with experimental results. Extensive parametric studies are conducted to elucidate the effects of the change in the concrete panel configuration, the number and diameter of the bolts, the type and strength of the concrete and the grade of the steel beam on the behaviour of the system. The use of modified rigid plastic analysis is assessed, and a modification is suggested to predict the flexural strengths of the composite beams and slab system. (C) 2016 Elsevier Ltd. All rights reserved.",,
11,"Kim, S; Kim, SA",Framework for Designing Sustainable Structures through Steel Beam Reuse,Article,reuse; design for reuse; material bank; life cycle assessment; life cycle cost; building information modeling,"The architecture, engineering, and construction sector requires carbon-intensive materials, such as steel, in the construction process and generates a large amount of waste in the life cycle. This causes global warming and waste problems. The demand for the reuse of construction materials is increasing, although it is not the convention, to reduce the environmental impact. Although the sustainable effect of the reuse of materials has been proven in several studies, materials are not always reused in practice, owing to the lack of an information system for reusable materials and the economic uncertainty. In this study, we propose a framework for designing structures using reusable steel beams. The design framework consists of a material bank and a design support tool. The material bank provides information on reusable materials based on the building information modeling. The design support tool generates efficient material procurement plans and provides information about the environmental and economic impact of the project. In a case study used to verify the framework, CO2 emissions were reduced by up to 77% through material reuse, which was consistent with the results of previous studies. However, owing to the cost of processing reusable materials, the overall cost was found to increase by up to about 40%. Therefore, an economic analysis over the entire life cycle when using reusable materials needs to be done.",,
172,"AbouHamad, M; Abu-Hamd, M",Framework for construction system selection based on life cycle cost and sustainability assessment,Article,,"The objective of this study is to develop a framework for the selection of construction systems of low and medium rise buildings used in residential, office and commercial applications. The construction systems considered are reinforced concrete framing (RC), structural steel framing (SS) and cold-formed steel framing (CFS). The framework is developed in accordance with the relevant guidelines for life cycle analysis and sustainability and is intended to support decision making in the design stage. The system boundary for the study is from cradle-to-grave, including all cost components from construction stage, use stage and disposal stage in addition to possible recycling/reuse options. The developed framework integrates building information modeling, energy simulation modeling and end of life scenarios to calculate and compare life cycle costs and sustainability advantages of construction system alternatives. All future costs are discounted to their present value using the appropriate interest rates. Uncertainties in the input parameters are modeled using realistic probability distributions and then used in a Monte Carlo sensitivity analysis to investigate the impact of changes in the input parameters on the result. Application of the developed system to a university building revealed the following results. The total life cycle cost is nearly the same for RC framing system and CFS framing system, while the life cycle cost of SS framing system is 13.4% more. When the system is credited for possible revenues resulting from early operation and recycling/reuse, the total life cycle cost of the RC framing system and the SS framing system become nearly the same while the life cycle cost of the CFS framing system becomes 22% less. Sensitivity analysis of the results shows that the discount rate has the most effect on the estimated mean cost followed by the inflation rate and the construction cost. The sustainability assessment focuses on calculating the LEED points associated with material recycling/reuse potentials and waste management. (C) 2019 Elsevier Ltd. All rights reserved.",10.1016/j.jclepro.2019.118397,0.0
85,"Rose, CM; Stegemann, JA",From Waste Management to Component Management in the Construction Industry,Article,,"The construction industry uses more resources and produces more waste than any other industrial sector; sustainable development depends on the reduction of both, while providing for a growing global population. The reuse of existing building components could support this goal. However, it is difficult to reclaim components from demolition, and materials remain cheap compared with labour, so new approaches are needed for reuse to be implemented beyond niche projects. This study therefore reviews waste interventions. Multiple case studies, spanning new builds and refurbishment, were undertaken to examine systemic mechanisms that lead to components being discarded. Evidence from fieldwork observations, waste documentation, and interviews indicates that the generators of unwanted components effectively decide their fate, and a failure to identify components in advance, uncertainty over usefulness, the perception of cost and programme risk in reclamation, and the preferential order of the waste hierarchy mean that the decision to discard to waste management goes unchallenged. A triage process is proposed to capture timely information about existing building components to be discarded, make this information visible to a wide community, and determine usefulness by focusing creativity already present in the industry on an exhaustive examination of component reusability and upcyclability.",10.3390/su10010229,0.0
127,"Gu, CC; Hu, J; Peng, YH",Functional case modelling for knowledge-driven conceptual design,Article,,"Traditional case modelling is focused on design configuration within product family for entire product reuse, while functional modelling provides a cross-domain function basis, which is much needed in concept generation. In this paper, we propose a combined approach; that is, functional case modelling for design concept alternatives. Functionality, structural information, and case attributes are integrated into functional case modelling. In particular, functional case attributes are derived from behavioural and environmental performances, which are different from traditional case modelling. Conceptual design aid is performed with two procedures in this framework. First, functional reasoning (FR) is employed for case clustering based on functionality. A case family is generated, the members of which are cross-product or even cross-domain families, and have similar functions with a required function. Second, constrained similarity measurement (CSM) is used for case selection from the case family, which is generated by FR. The CSM takes design constraints into consideration for design problem solving, which makes the case selection more reasonable. A prototype system named a functional case design support system is developed based on this framework, and a case study is presented to demonstrate this approach.",10.1177/0954405411428257,0.0
105,"Martin, CJ; Upham, P",Grassroots social innovation and the mobilisation of values in collaborative consumption: a conceptual model,Article,,"There is growing interest in the potential of grassroots innovations to play a role in the transition to sustainable production and consumption systems. However, the role of values has been little considered in relation to the development and diffusion of grassroots innovations. We develop a conceptual model of how citizens' values are mobilised by grassroots innovations, drawing on the value theory of Schwartz et al. (2012) and the theory of collective enactment of values of Chen et al. (2013). Using the results of a large scale survey of free reuse groups (e.g. Freecycle and Freegle), which enable collaborative forms of consumption, we apply the conceptual model to explore how participants' values are mobilised and expressed. We show that while the majority of free reuse group participants do hold significantly stronger self-transcendence (i.e. pro-social) values than the wider UK population, they also hold other values in common with that population and a minority actually place less emphasis on self transcendence values. We conclude that diffusion of this particular grassroots innovation is unlikely to be simply value limited and that structural features may be more significant. (C) 2015 The Authors. Published by Elsevier Ltd.",10.1016/j.jclepro.2015.04.062,0.0
217,"Shalaby, M; Saitou, K","HIGH-STIFFNESS, LOCK-AND-KEY HEAT-REVERSIBLE LOCATOR-SNAP SYSTEMS FOR THE DESIGN FOR DISASSEMBLY",Proceedings Paper,,"Recent legislative and social pressures have driven manufacturers to consider effective part reuse and material recycling at the end of product life at the design stage. One of the key considerations is to use joints that can disengage with minimum labor, part damage, and material contamination. This paper extends our previous work on the design of high-stiffness reversible locator-snap system that can disengage non-destructively with localized heat [1, 2], to include 1) modeling for tolerance stack-up and 2) lock-and-key concept to ensure that snaps only disengage when the right procedure is followed. The design problem is posed as an optimization problem to find the locations, numbers, and orientations of locators and snaps, and the number, locations and sizes of heating areas, which realize the release of snaps with minimum heat, compliance, and tolerance stack-up. The motion and structural requirements are considered constraints. Screw Theory is utilized to precalculate a set of feasible types and orientations of locators and snaps that are examined during optimization. The optimization problem is solved using Multi Objective Genetic Algorithm (MOGA) coupled with structural and thermal FEA. The method is applied on two case studies. The Pareto-optimal solutions present alternative designs with different trade-offs between the design objectives while meeting all the constraints.",,
93,"Ronzon, T; Iost, S; Philippidis, G",Has the European Union entered a bioeconomy transition? Combining an output-based approach with a shift-share analysis,Article,,"The bioeconomy is a collective of activities charged with the production of biologically renewable resources or 'biomass' (e.g. agriculture, forestry), its diverse application (e.g. food, textiles, construction, chemicals) and subsequent reuse (e.g. compositing, waste management). Since the European Union (EU) launched its bioeconomy strategy in 2012, further bioeconomy policy initiatives have proliferated at regional, national and pan-European levels. Moreover, the EU Green Deal announced in 2019 targets a transition towards a low-carbon sustainable model of growth, food and energy security, biodiversity and natural resource management, where it is envisaged that the bioeconomy will play a key role. Despite a paucity of available data, the surge in policy interest has triggered the need for evidence-based monitoring of bioeconomy sectors and the efficient tailoring of policy support. Thus, on a Member State (MS) basis for the period 2008-2017, we (1) adopt an 'output-based' approach to construct a panel data of performance indicators and (2) characterise the sources of growth and transitional stage of the bioeconomy. Results reveal that the bioeconomy has maintained its relative importance within the total EU27 economy. At the EU level, agriculture and the food industry have played a key role in driving a transition in the primary and industrial bioeconomy sectors due to their significant labour productivity-enhancing impact. Four Northern MS exhibit a bioeconomy transition by modernising their bioeconomy activities and operating structural changes. Other Northern and Western EU MS are still in the early stages of a transition, whilst in Eastern and Central Europe, such a transition remains elusive.",10.1007/s10668-021-01780-8,0.0
19,"Llorente-Gonzalez, LJ; Vence, X","How labour-intensive is the circular economy? A policy-orientated structural analysis of the repair, reuse and recycling activities in the European Union",Article,,"The socio-economic structural conditions for the transition towards a circular economy (CE) are little explored, as most of the research is concerned with technical and organizational aspects. The few studies addressing the matter focus on the estimation of GDP growth and job creation potential of certain circular activities (CA). These CA are assumed to be labour-intensive, so job losses resulting from the paradigm shift should be offset by the overall gains. However, significant structural differences in the economic characteristics of these activities suggest that their development may have dissimilar socio-economic implications, while their promotion would require diverse policy instruments. This paper aims to study the current sectoral structure, main economic features and recent evolution of the CA in the European Union. The focus is on the 24 activities that, according to the NACE Rev. 2, compose the repair, reuse and recycling sectors, as a limited yet representative subset of all the CA currently bound and constrained within the predominant linear economy. Results show that significant differences in labour intensity exist between repair and reuse, on the one hand, and recycling, on the other. Besides, employment concentrates in low-wage labour-intensive CA, suggesting that more attention should be paid to improving competitiveness and working conditions in activities such as repair and reuse which are by definition both ecological and inclusive. Also, the structural heterogeneity of the activities under analysis imply the need for targeted policy instruments tailored to the specificities of each of the various CE sub-sectors.",10.1016/j.resconrec.2020.105033,0.0
116,"De Masi, RF; Ruggiero, S; Vanoli, GP",Hygro-thermal performance of an opaque ventilated facade with recycled materials during wintertime,Article,,"This study investigates the thermo-hygrometric behaviour in wintertime of an open-joint ventilated fa & ccedil;ade, designed to be environmentally sustainable. It is the result of the Horizon Project RE4-REuse and REcycling of CDW materials and structures in energy efficient pREfabricated elements for building REfurbishment and construction and it is composed by prefabricated elements made by recycled materials from construction and demolition waste. The designed fa & ccedil;ade has been installed in a full scale test-room located in Benevento (south Italy), with typical Mediterranean climate. The proposed analysis suggests that for the behaviour of the designed fa & ccedil;ade, the main influential factors are the solar radiation and the outdoor air temperature meanwhile the wind effect is negligible. Some mathematical correlations have been found and an empirical model that describes the air temperature in the cavity as a function of the external climatic parameters is developed. These findings could be useful for the assessment of performance of similar facades in the design phase but also for comparing the behaviour in different climates. All tests demonstrate that in winter time, in a humid and rainy climate, the prevalent effect is the insulation and the ventilation does not increase the heat losses. The designed system can effectively control the moisture content in the building envelope materials, ensuring dry surfaces and at the same time avoid the alteration of the thermo-hygrometric characteristics for the bacteria and mould proliferation, ensuring healthy environment and avoiding structural damage. (c) 2021 Elsevier B.V. All rights reserved.",10.1016/j.enbuild.2021.110994,0.0
220,"Lekkas, DF; Manoli, E; Assimacopoulos, D",INTEGRATED URBAN WATER MODELLING USING THE AQUACYCLE MODEL,Article,,"The traditional approach to urban water management is primarily based on a supply-oriented approach, where water follows a one-way path from supply to a single use, treatment and then discharged to the environment. The wide acknowledgement of the need to shift towards more sustainable practices has led to the recognition that demand is multi-faceted; delivered supply should correspond to the varying characteristics of users, taking into account their actual needs in terms of quantity, quality and level of reliability. Such an approach can entail the application of reuse and reclamation methods, which allow for the multiple use of water to meet higher to lower quality needs. Integrated urban water cycle modelling can be a powerful tool in estimating the potential for the application of such options, as it considers issues related to water supply, wastewater production and stormwater runoff in a holistic framework. This paper presents preliminary results from the application of an integrated urban water balance model, Aquacycle, in the Greater Athens Area. The Aquacycle model accounts for water pathways by simulating two subsystems of the urban water cycle (the rainfall-run-off network and the water supply-wastewater network), and the interactions between them. The software package can also be used for evaluating alternative stormwater and wastewater reuse schemes. In this paper, Aquacycle was used for simulating water use, wastewater production and stormwater drainage in the Greater Athens Area. For applying the model, the region was divided into smaller - cluster - scales, according to specific structural characteristics. Then, the model was calibrated and validated against measured data, so that model outputs can account for the overall complexity of the Athens urban environment. Finally, three alternative scenarios, comprising the application of on-site recycling and reuse technologies were simulated and evaluated on the basis of three sustainability indicators (i.e. reduction of imported freshwater, wastewater and stormwater discharge).",,
59,"Llop, M; Ponce-Alifonso, X",Identifying the role of final consumption in structural path analysis: An application to water uses,Article,,"The complexity of the connections within an economic system can only be reliably reflected in academic research if powerful methods are used. Researchers have used structural path analysis (SPA) to capture not only the linkages within the production system but also the propagation of the effects into different channels of impacts. However, the SPA literature has restricted itself to showing the relations among sectors of production, while the connections between these sectors and final consumption have attracted little attention. In order to consider the complete set of channels involved, in this paper we propose a structural path method that endogenously incorporates not only sectors of production but also the final consumption of the economy. The empirical application comprises water usages, and analyses the dissemination of exogenous impacts into various channels of water consumption. The results show that the responsibility for water stress is imputed to different sectors and depends on the hypothesis used for the role played by final consumption in the model. This highlights the importance of consumers' decisions in the determination of ecological impacts. (C) 2014 Elsevier B.V. All rights reserved.",10.1016/j.ecolecon.2014.11.011,0.0
144,"Meshref, A; El-Dash, K; Basiouny, M; El-Hadidi, O",Implementation of a Life Cycle Cost Deep Learning Prediction Model Based on Building Structure Alternatives for Industrial Buildings,Article,,"Undoubtedly, most industrial buildings have a huge Life Cycle Cost (LCC) throughout their lifespan, and most of these costs occur in structural operation and maintenance costs, environmental impact costs, etc. Hence, it is necessary to think about a fast way to determine the LCC values. Therefore, this article presents an LCC deep learning prediction model to assess structural and envelope-type alternatives for industrial building, and to make a decision for the most suitable structure. The input and output criteria of the prediction model were collected from previous studies. The deep learning network model was developed using a Deep Belief Network (DBN) with Restricted Boltzmann Machine (RBM) hidden layers. Seven investigation cases were studied to validate the prediction model of a 312-item dataset over a period of 30 years, after the training phase of the network to take the suitable hidden layers of the RBM and hidden neurons in each hidden layer that achieved the minimal errors of the model. Another case was studied in the model to compare design structure alternatives, consisting of three main structure frames-a reinforced concrete frame, a precast/pre-stressed concrete frame, and a steel frame-over their life cycle, and make a decision. Precast/pre-stressed concrete frames were the best decision until the end of the life cycle cost, as it is possible to reuse the removed sections in a new industrial building.",10.3390/buildings12050502,0.0
160,"Qi, JR; Yang, HC","Improvement of a Truss-Reinforced, Half-Concrete Slab Floor System for Construction Sustainability",Article,,"The truss-reinforced half-concrete slab has been widely used in prefabricated construction all over the world. It has become the most widely used prefabricated component form in China. However, its construction cost is higher than using the conventional construction method. To improve the half slab floor system, it is essential to have a comprehensive understanding of the truss-reinforced half slab's structural performance over its complete loading history. Six experimental tests on such slabs were carried out. Three of them were reinforced with a steel bar truss (SBT) and the other three with a steel tube/bar truss (STBT). The steel tube in an STBT was grouted. The results show that when the specimen is damaged, the grouted steel tube does not undergo out-of-plane or in-plane buckling, and its force performance is good when compared to the steel bar in SBT. Compared with the SBT-reinforced slab specimens, the load characteristic values of the STBT-reinforced slabs were significantly improved, and the slabs had greater initial stiffness and resistance to deformation. Due to the fact that good structural performance of the steel tube was observed, after having studied the half slab component design, a dry, prefabricated, STBT-reinforced half slab system that can reduce the volume of concrete and amount of steel used in the present slab system is proposed. The proposed system has the advantages of allowing easier construction, cost reduction, and reuse of the components afterward to make the prefabrication construction more sustainable.",10.3390/su13073731,0.0
