,Authors,Article Title,Document Type,Author Keywords,Abstract,DOI,DOI Link
27,"Bui, TD; Tseng, JW; Tseng, ML; Lim, MK",Opportunities and challenges for solid waste reuse and recycling in emerging economies: A hybrid analysis,Article,,"This study enriches sustainable solid waste management knowledge by establishing a valid hierarchical model and critiques the causal interrelationship between waste reuse and recycling attributes. The challenges and opportunities for sustainable waste reuse and recycling are emphasized, and direction is provided for practices. Many developing and emerging countries have been attempting to address solid waste management problems and serious restrictions on material reuse and recycling activities. However, it is not well developed, and reuse and recycling efforts have not yet been well implemented due to weak economic and political institution levels. This study aims to propose a sustainable solid waste management model and address opportunities and challenges for waste reuse and recycling in a developing country. A hybrid approach is adopted using a systematic data-driven analysis comprising content analyses, system uncertainty and complexity, the fuzzy Delphi method, interpretive structural modeling, and the fuzzy decision-making trial and evaluation laboratory. The results show that 19 valid indicators are congregated into five aspects, in which circular resource management, societal requirements, and municipal sustainability are causative aspects with the capability to improve sustainable solid waste management as it regards waste reuse and recycling. The top prominent indicators helping to enhance practices are the circular economy, the informal sector, material flow analysis, policy restrictions, waste treatment technologies. The state-of-the-art literature is presented, and further opportunities and challenges are determined.",10.1016/j.resconrec.2021.105968,0.0
16,"Brutting, J; Senatore, G; Fivet, C",Optimization Formulations for the Design of Low Embodied Energy Structures Made from Reused Elements,Proceedings Paper,,"The building sector is one of the major contributors to material resource consumption, greenhouse gas emission and waste production. Loadbearing systems have a particularly large environmental impact because of their material and energy intensive manufacturing process. This paper aims to address the reduction of building structures environmental impacts through reusing structural elements for multiple service lives. Reuse avoids sourcing raw materials and requires little energy for reprocessing. However, to design a new structure reusing elements available from a stock is a challenging problem of combinatorial nature. This is because the structural system layout is a result of the available elements' mechanical and geometric properties. In this paper, structural optimization formulations are proposed to design truss systems from available stock elements. Minimization of weight, cut-off waste and embodied energy are the objective functions subject to ultimate and serviceability constraints. Case studies focusing on embodied energy minimization are presented for: ( 1) three roof systems with predefined geometry and topology; ( 2) a bridge structure whose topology is optimized using the ground structure approach; ( 3) a geometry optimization to better match the optimal topology from 2 and available stock element lengths. In order to benchmark the energy savings through reuse, the optimal layouts obtained with the proposed methods are compared to weight-optimized solutions made of new material. For these case studies, the methods proposed in this work enable reusing stock elements to design structures embodying up to 71% less energy and hence having a significantly lower environmental impact with respect to structures made of new material.",10.1007/978-3-319-91635-4_8,0.0
54,"Dunant, CF; Drewniok, MP; Sansom, M; Corbey, S; Cullen, JM; Allwood, JM",Options to make steel reuse profitable: An analysis of cost and risk distribution across the UK construction value chain,Article,,"Although steel reuse has been identified as an effective method to reduce the carbon and energy impact of construction, it is in effect only a marginal practice. A detailed analysis of the costs and risks of reuse in practice in the UK is lacking. We found that although there is a sufficient spread between the price of steel scrap and new steel, this difference cannot be captured by the demolition contractors. Rather, reused steel is somewhat more expensive than new elements, except in certain circumstances such as when the reused elements are available from a nearby site, or when testing elements can be avoided. Further, we show that neither the costs of steel reuse, nor the risks, nor its benefits are spread equitably throughout the construction industry supply chain: most of the substantial and capital-intensive changes required for the widespread adoption of steel reuse are concentrated on steelwork contractors and stockists. Based on this analysis, we suggest helping the emergence of a specialised stockist. (C) 2018 The Authors. Published by Elsevier Ltd. This is an open access article under the CC BY license.",10.1016/j.jclepro.2018.02.141,0.0
261,"Vegetti, M; Leone, H; Henning, G",PRONTO: An ontology for comprehensive and consistent representation of product information,Article,,"Nowadays, it is quite common for collaborating organizations (or even different areas within a company) to develop and maintain their own product model. This situation leads to information duplication and its associated problems. Besides, traditional product models do not properly handle the high number of variants managed in today competitive markets. In addition, there is a need for an integrated product model to be shared by all the organizations participating in global supply chains (SCs) or all the areas within a company. One way to reach an intelligent integration among product models is by means of an ontology. PRoduct ONTOlogy (PRONTO) is an ontology for the product modeling domain, able to efficiently handle product variants. It defines and integrates two hierarchies to represent product information: the abstraction hierarchy (AH) and the structural one (SH). This contribution presents a ConceptBase formal specification of PRONTO that focuses on the structural hierarchy of products. This hierarchy is a tool to handle product information associated with the multiple available recipes or processes to manufacture a particular product or a set of similar products. The formal specification presented in the paper also includes mechanisms to infer structural information from the explicit knowledge represented at each of the AH levels: Family, VariantSet and Product. This proposal efficiently handles a great number of variants and allows representing product information with distinct granularity degrees, which is a requirement for planning activities taking place at different time horizons. PRONTO easily manages crucial features that should be taken into account in a product representation, such as the efficient handling of product families and variants concepts, composition and decomposition structures and the possibility of specifying constraints. To demonstrate the semantic expressiveness of the proposed ontology a food industry related case-study is addressed and discussed in detail. (C) 2011 Elsevier Ltd. All rights reserved.",10.1016/j.engappai.2011.02.014,0.0
23,"Hosseini, SM; Mashiri, F; Mirza, O",Parametric study of innovative bolted shear connectors using 3D fi nite element modelling,Article,Composite beam; Headed studs; Bolted shear connector; Direct shear tests; Finite element modelling,"This paper describes an extensive numerical analysis and parametric studies conducted to evaluate the performance of shear connectors as a key component in the design of composite beams. The shear connector is essentially used to transfer shear forces across steel beams and concrete slabs in composite structures. However, conventional methods which rely mainly on the welded stud shear connector are not as efficient in terms of recycling and reusing building components. Therefore, to address the issues of deconstruction and materials reuse and to improve the structural performance of the composite beams, bolted shear connectors have been developed to replace the conventional welded stud. In order to further study their behaviour, the structural performance of the bolted shear connectors were simulated and compared with the welded studs using Abaqus software. A tridimensional numerical model was validated using previously conducted experimental tests and was used as a reference for the parametric study. Height to diameter ratio, friction coefficient of steel-concrete interface, and concrete strength were selected as the main variables for the parametric study, along with the effects of the bolt-hole clearance. The results of numerical simulation were used to develop shear stress and ductility criteria of the innovative shear connector for design rules. The results of parametric studies also showed that the load carrying capacity of composite beams using the bolted shear connectors is influenced by the bolt's height, the friction coefficient of contact surfaces and the concrete strength. Crown Copyright (c) 2021 Published by Elsevier Ltd. All rights reserved.",,
259,"Huuhka, S",Partial dismantling of 1960's to 80's neighbourhoods - a sustainable holistic solution,Proceedings Paper,,"Prefabricated blocks of flats in 1960's to 1980's neighbourhood units are the underdogs of the Finnish housing stock. The scope of issues has different tones in growth centres and declining regions. The discussion of demolishing 1960-80's developments started in the 2000's. However, recent studies on the carbon spike of new building as well as the energy and durability performance of existing buildings suggest that a sustainable solution would be not to demolish. To stay in use, 1960-80's housing estates must respond to today's housing preferences. Partial dismantling of large-panel blocks of flats and subsequent element reuse is a holistic solution to a spectrum of interconnected issues. It's feasible in eliminating vacancy, improving image and striving for social cohesion, which all improve the viability of residential areas. Reusing large concrete panels can significantly reduce the environmental burden of new building and introduce the cradle-to-cradle design approach to the Finnish construction industry.",,
30,"Chan, J; Bachmann, C; Haas, C",Potential economic and energy impacts of substituting adaptive reuse for new building construction: A case study of Ontario,Article,,"Adaptive reuse is an alternative to a building's end-of-life where its function is extended to serve another purpose. Many studies suggest that adaptive reuse is more sustainable than typical demolition and new construction in terms of environmental, social, and economic impacts. However, these claims are qualitative in nature and are limited to analyses at the project scale. This paper presents a methodology based on Input-Output (IO) models for examining economic and energy impacts of substituting adaptive reuse for new building construction. An IO model for the Province of Ontario, Canada, was developed to study the impacts of adaptive reuse building construction. The building construction industries' intermediate inputs and final demands were altered in the Ontario IO model to reflect changes in the supply and demand of adaptive reuse buildings in the construction industries. A basic scenario represents the situation where only the building's superstructure and substructure are reused. The basic scenario was then extended to reflect the reuse of internal non-structural components. The Ontario IO model examines impacts to gross domestic product (GDP), industry outputs, employment and energy use (including rebound effects from household consumption changes). It was found that adaptive reuse building construction may benefit Ontario's economy and reduce energy consumption under certain combinations of changes in supply and demand. The desired domain of adaptive reuse construction, where energy use decreases, while GDP and employment increases, is discerned for both the residential and non-residential building construction sectors in Ontario. This methodology may be used for other regions for which IO information exists. (C) 2020 Elsevier Ltd. All rights reserved.",10.1016/j.jclepro.2020.120939,0.0
18,"Rakhshan, K; Morel, JC; Daneshkhah, A",Predicting the technical reusability of load-bearing building components: A probabilistic approach towards developing a Circular Economy framework,Article,,"The construction sector is the largest consumer of raw materials and accounts for 25%-40% of the total CO2 emissions globally. Besides, construction activities produce the highest amount of waste among all other sectors. According to the waste hierarchies, reuse is preferred to recycling; however, most of the recovery of construction and demolition wastes happens in the form of recycling and not reuse. Part of the recent efforts to promote the reuse rates includes estimating the reusability of the load-bearing building components to assist the stakeholders in making sound judgements of the reuse potentials at the end-of-life of a building and alleviate the uncertainties and perceived risks. This study aims to develop a probabilistic model using advanced supervised machine learning techniques (including random forest, K-Nearest Neighbours algorithm, Gaussian process, and support vector machine) to predict the reuse potential of structural elements at the end-of-life of a building. For this purpose, using an online questionnaire, this paper seeks the experts' opinions with actual reuse experience in the building sector to assess the identified barriers by the authors in an earlier study. Furthermore, the results of the survey are used to develop an easy-to-understand learner for assessing the technical reusability of the structural elements at the end-of-life of a building. The results indicate that the most significant factors affecting the reuse of building structural components are design-related including, matching the design of the new building with the strength of the recovered element.",10.1016/j.jobe.2021.102791,0.0
53,"Mendoza, M; Chilton, J",Preservation and reuse of reinforced concrete hyperbolic paraboloid shells in the UK,Proceedings Paper,,"During the 1950s concrete shell structures, including hyperbolic paraboloid 'hypar' structures, gained a foothold in Britain's architectural and engineering realm. Amongst the 'hypar' structures built during this period, those designed by Sam Scorer - Lincoln Motor Car Company Showroom, 1958-59, and a petrol station canopy at Markham Moor, 1960-61, as well as the John Lewis Warehouse, Stevenage, by Yorke, Rosenberg and Mardal (YRM), 1963, Queensgate Market Hall, Huddersfield, 1970, by Seymour Harris Architects, and the former Commonwealth Institute, London, by Robert Matthew, Johnson-Marshall and Partners, 1960-62, are some of the most iconic and representative. These structures bear witness to the technological developments in the construction sector as well as the government plans to support the economic growth of Post-War Britain. However, and as is true for most concrete shell structures in the world, these structures have dealt with the challenge of preservation and reuse in different ways, and some of them have been at risk of loss. At present, these structures have been listed Grade II or II* by Historic England, due to their architectural value. This paper gives account of the current use and state of these and other reinforced concrete shell structures in the UK.",,
100,"Yap, JBH; Abdul-Rahman, H; Wang, C",Preventive Mitigation of Overruns with Project Communication Management and Continuous Learning: PLS-SEM Approach,Article,,"Failure to communicate effectively and poor project knowledge continue to plague the construction industry, particularly concerning delay management and cost control. This paper aims to empirically examine the influence of project communication management and project learning as preventive measures to mitigate time-cost overruns. Based on a comprehensive literature review, a conceptual framework was developed. A two-stage data collection was used, namely semistructured interviews and a broad questionnaire survey. The qualitative data was analyzed by content analysis of critical incidents. Partial least-squared based structural equation modeling (PLS-SEM) analyses statistically tested the model hypotheses. The results suggest that project communications and project learning contribute positively to time-cost performance of construction projects. Effective communication tools, critical learning situations, and essential reusable project knowledge are identified. Collective sharing of experiences facilitates personal development and enables effective project learning. A triangulated approach was adopted to conceptualize the control loop-process emphasis on networking and communication, collaborative learning, experience accumulation, and expert judgment as critical elements of continuous learning. As such, this study advances the current knowledge of exploiting project communication management and project learning in mitigating time-cost overruns in construction.",10.1061/(ASCE)CO.1943-7862.0001456,0.0
11,"Xia, B; Xiao, JZ; Ding, T; Zhang, KJ",Probabilistic sustainability design of structural concrete components under climate change,Article,,"A probabilistic sustainability design method for quantifying the benefits from sustainable structural strategies under climate change is put forward in this study. To help curb the vicious circle of increasing structural and environmental degradation, the sustainable probability is defined as a conditional probability, and the interaction between structural reliability and environmental impacts is quantified. Global warming potential (GWP) is adopted as the key indicator for environmental impacts. By analyzing the trends of climate change, the GWP limit is set to match the prediction of structural resistance degradation. A new environmental impact allocation rule based on time-dependent resistance is put forward to characterize the environmental benefits of the reuse strategy. With help of the durability life prediction method for reusable components and the stochastic model for time-dependent resistance, the calculation method for sustainable probability is established, catering for both reusable and non-reusable structural components. With the Monte Carlo simulation, the proposed sustainability design process is implemented in a numerical example. Results show that the reusable structural concrete component design can simultaneously satisfy the current and future safety and environmental requirements, meeting the demand for sustainable development.",10.1016/j.strusafe.2021.102103,0.0
206,"de Camargo, MM; Lintz, RCC; Gachet-Barbosa, LA; Pires, MSG",Production of concrete blocks with residues for civil construction,Proceedings Paper,,"The Construction is recognized as one of the most important activities for the economic and social development, and on the other hand, behaves also as a major generator of environmental impacts, either by consumption of natural resources, the modification of the landscape or the generation of construction and demolition waste(CDW). Investing in an implementation of managed clean and healthy in the area of CDW is essential for the environment and for the economy of the cities, who are spending less resources on the collection, cleaning of drains and treatment of diseases. Nowadays, the amount of waste generated is considered large, occupying much space in landfills, and its transportation, depending on the volume and weight, is quite expensive. Recycling and reuse of these wastes are extremely important to control and mitigate environmental problems, as well as produce various materials value-added. Over 90% of waste can be recycled, reused and transformed into aggregates with characteristics very similar to the original product, thus creating environmentally friendly products such as sand, gravel, pebbles. This research concerns the study of the properties of concrete containing CDW, aiming its use in the manufacture of concrete blocks to seal without structural function. Blocks have been molded with partial replacement of natural aggregates by recycled aggregates and later were performed tests of compressive strength in accordance with the standards to prove the technical feasibility of the material for the trait studied.",10.4028/www.scientific.net/AMR.690-693.865,0.0
28,"Niu, YS; Rasi, K; Hughes, M; Halme, M; Fink, G",Prolonging life cycles of construction materials and combating climate change by cascading: The case of reusing timber in Finland,Article,,"The aim of this study is to investigate the economic, environmental and technological challenges, as well as the environmental potential, of prolonging the life cycle of construction materials with focus on structural timber in Finland. To achieve this, a literature review was conducted along with interviews with actors pertinent to timber construction. Moreover, a case study of life cycle environmental impact assessment was conducted to quantify the potential of reusing timber to abate global warming and other environmental burden. The literature review highlighted the possibility of reusing structural timber, but pointed to the need for efficient and standardized assessment criteria. The interviews indicated interest towards the concept of circular economy applied to construction and demolition wood material, although this appears to be driven more by policy and regulation rather than for business reasons. Therefore, a reconfigured conceptual framework to achieve circularity for wood is proposed, where material brokers would be used to connect different actors along the value chain. The paper concludes with a case study showing that reusing structural timber components can result in a significant reduction of the environmental burden.",10.1016/j.resconrec.2021.105555,0.0
162,"Sharifi, Z; Shokouhyar, S",Promoting consumer's attitude toward refurbished mobile phones: A social media analytics approach,Article,,"Resource depletion and environmental issues persuade manufacturers to reuse and recycle electronic products. One green strategy in mobile device manufacturing is to refurbish and reuse these products. Consumer feedback in the secondary market impress decision-makers and manufacturer strategies. This research provides a framework that focuses on data mining techniques to investigate consumer attitudes toward refurbished phones by one of the reverse supply chain practices: refurbishment. Furthermore, the consumer's opinions on refurbished mobile phones found on Twitter have been analyzed, and the most appropriate selling strategy has been proposed. Accordingly, the customer's strong motivating factors were identified by assessing approximately 25,000 tweets. The obtained data are analyzed according to three categories: environmental versus financial motivators, refurbished mobile phone features, and main components of refurbished mobile phones. The results indicate that the environmental factor is slightly higher motivating when compared to the financial factor. Other important features were prioritized from the consumer's point of view (highest to lowest): price, product warranty, quality, and seller's reputation. In a separate analysis, camera, display, battery, performance, innovative technologies, and internal memory were found to be the top components of a mobile device that customers pay attention to the most. Interrelationships between identified features were established using interpretive structural modeling (ISM) to accomplish a comprehensive framework. Classification analysis was performed by the matrix of cross-impact multiplications applied to classifications (MICMAC) technique to identify these features based on their driving and dependence power. Camera, screen, battery, internal storage, and performance were significant features that affected customer's attitudes.",10.1016/j.resconrec.2021.105398,0.0
